ID,post,class_name,class_id
7c04ba54-8d45-4914-817a-bd477031957f,"it's an especially touching song, and sadly relevant right now. kinda difficult to watch since they performed this the day of chris's passing, but there's catharsis to be found in the performance. what other songs do you feel help you cope with the death of someone close to you?",none,5
3c98f09c-7bc2-47d3-b95c-3787c2076dfc,"i typically use unbiased or progressive sources for my news and politics, so for one week i decided to limit myself to conservative shows on fox and websites like the drudgereport. i had of course seen clips from fox shows and even caught an episode or two years ago but i hadn't sat down for multiple episodes in a row like a true fan. my thesis going into my little experiment was that i would find that the conservative sources were more accurate and less cartoonishly biased and ridiculous than how they were portrayed in my typical news sources. my experience surprised me: * **the facade of debate:** if i only watched shows like the five, the o'reilly factor and america live with megyn kelly i would think that progressives were all weak, dim, unable to argue even basic issues, and that they didn't believe in their overly convoluted (read: not common sense) rationalizations. [the is a show with five hosts, where 2 co-alpha males and 2 attractive females belittle an overweight, gray haired buffoon who throws out half arguments then defeatedly nods and exhales as the confident and dismissive conservatives set him straight. on one episode of the o'reilly factor, they had a segment on the health care birth control controversy and they brought on a small time radio radio host who would make half a point, get cut off and mocked in a dismissive manner (pattern!) by o'reilly then giggle and acquiesce. in o'reilly's other segments, geraldo rivera and bernard goldberg, the latter a conservative and the former a fox reporter and dullard, would again half-heartedly make one or two ""progressive"" arguments then be set straight by o'reilly. * **the online echo chamber, or how to self-censor the greatest tool for communication and information since the printing press:** so the cbo released a new budget projection for obama's health care plan over 9 years, the big (true) story was that the new projection was [billions less than a previous and if you searched for articles from non-partisan sources that's exactly what you learned. however when i did a search for ""cbo cost health care legislation"" over the first 24 hrs, [i got a very different for me, the very first result was a [washington examiner where the journalist proclaims that the cbo budget shows a 1.76 trillion dollar cost to obamacare, which he says is nearly double obama's original claim of around 900 billion. the problem here is that his cost is a **gross** cost- it doesn't take into account offsetting revenue and spending reductions which would bring the cost down to ~1 trillion which is what the non partisan sources are reporting. seems like a clearly, egregiously misleading statement on the reporter's part and surely one that would be quickly rebutted by other sources telling the truth. the problem is that if you went to any conservative site over the first 24 hrs, literally every single site referred to the washington examiner article alone and made the same claim, that obama lied about the costs by nearly 100%. if you remember the recent study that showed that [fox news viewers are actually less informed than people who don't watch news at you can now see exactly how this happens. finally- * **talking points as journalism:** prior to my week of conservative media i saw a [daily show about a conservative talking points memo that fox news's steve doocy erroneously read on the air. indeed, the most striking part of my experience was how consistently the same set of talking points were made across all conservative media. on every show and every website the same ""common sense"" conclusions were made by both ""opinion"" pundits like o'reilly and supposedly objective fox reporters: a) gas prices were not only controllable by the president but the current price was the result of his energy policy (not the shutting down of refineries on the east coast, not the massive consumption growth by the worlds two most populous countries china and india, and not iran's blockade of the strait of hormuz-&gt; a situation that is conveniently being exacerbated by us conservatives' saber rattling), b) obama lied about health care costs by 100% as i explained earlier, and c) bill maher's use of the word cunt in describing palin was equivalent to limbaugh calling sandra fluke a slut and obama was hypocritical to not return maher's donation. i heard these same points hammered into my head over and over again, without any sort of nuance or debate. even if your media consumption included non-partisan sources, it would be incredibly challenging to not buy into the only arguments being set forth by every conservative news source that you at least respected enough to consume. if you believe that fox's reportage is compartmentalized from its pundit echo chamber, as they claim, then you have no chance whatsoever. the day after the cbo budget was released, every supposedly unbiased fox reporter's focus was on the 900 billion to 1.76 trillion dollar gap or on gas prices and the president's early refusal of the keystone oil pipeline. in conclusion, if you're like me and you avoided conservative news sources like the plague not because they were conservative but because you suspected the reportage was terrible, you were right. and if you feel comfortable in obama's chances for reelection, mostly because of poor competition, don't underestimate just how misinformed conservatives and right leaning independents may be. **edit:** i avoided adding an edit for awhile because the ""thank you speech"" edits drive me fucking crazy, but i do want to give a few blanket answers to the literally hundreds of direct questions i've gotten: * yes i'm aware that there is no truly, purely, unbiased source but i thought that was so obvious i didn't need to say it- apparently not... i'm a naturally skeptical person so even though i consider npr, bbc, pbs, nyt, reuters and al jazeera to be as close to unbiased as there is, i'm always wary of being sold to, and i watch for the sin of omission in their reportage. * yes i watched the supposedly unbiased reporters on fox news, i even emphasized this point in my write-up, but i guess people didn't read the whole thing. it's important to reiterate because this is basically how fox tricks you, as [david frum they convince you that every non-conservative source is biased and that only they are telling the truth. but as i showed in my cbo budget example, this is demonstrably untrue. * i absolutely, honestly went into this experiment thinking that some of my preconceptions would be proven untrue, and it truly made me nervous- no one likes that initial feeling of having deeply held beliefs shaken, it's very unsettling. but the truth was worse than i expected, fox tv is almost a parody of a propaganda machine and if you don't believe it try the experiment yourself, it doesn't take much investment to change channels and unsubscribe from [/r/politics](/r/politics). * many have asked me to do a similar version with the liberal media, but i already consume liberal media along with my non-partisan sources and you do too if you come to [/r/politics](/r/politics). the fact is, from my experience, when i learn something from a liberal source such as [/r/politics](/r/politics), huffingtonpost, the daily show/colbert, politico (may be considered neutral) and then i read the unbiased and the occassional conservative source, that ""liberal"" information is rarely contradicted by reality. when i took in conservative rhetoric i would often a) immediately know something was incorrect because of for instance my education in business and economics, b) find out later it was factually incorrect such as in the cbo example, or c) recognize the logical fallacy in their arguments- if anything proved the lack of sophistication of their audience, it was that they would tolerate such terrible argumentation. if you looked at my link to the study about how[ informed particular viewers you can see that even comedic satire from the daily show gets you closer to the facts than so-called news from fox. * finally, i just wanted to say that i will now continue to consume conservative sources (i have drudge as a favorite) because i learned that it gives me direct access to republicans' game plan, and because it's always good to hear counter arguments even if they're not always intellectually honest.",none,5
de541a1b-e433-43ef-931a-f91050e9e3cd,"we are the team behind project discovery - exoplanets, a joint effort of wolf prize winner michel mayor’s team at university of geneva, ccp games, massively multiplayer online science (mmos), and the university of reykjavik. we successfully integrated a huge set of light data gathered from the corot telescope into the massively multiplayer game eve online in order to allow players to help identify possible exoplanets through consensus. eve players have made over 38.3 million classifications of light data which are being sent back to university of geneva to be further verified, making the project remains one of the largest and most participated in citizen science efforts, peaking at over 88,000 per hour. this is the second version of project discovery, the first of which was a collaboration of the human protein atlas to classify human proteins for scientific research. joining today are * wayne gould, astronomer with a master’s degree in physics and astrophysics who has been working at the geneva observatory since january and is responsible to prepare and upload all data used in the project * attila szantner, founder and ceo of massively multiplayer online science who founded the company in order to connect scientific research and video games as a seamless gaming experience. * hjalti leifsson, software engineer from ccp games, part of the team who is involved in integrating the data into eve online we’d love to answer questions about our respective areas of expertise, the search for exoplanets, citizen science (leveraging human brain power to tackle data where software falls short), developing a citizen science platform within a video game, how to pick science tasks for citizen science, and more. more information on project discovery: exoplanets video explanation of project discovery in eve: edit---wrapped up thanks to all of you for your questions, it has been a great experience hearing from the players side. once again a big thanks to all of you who have participated in the project and made the effort of preparing all this data worth it. ~wayne thank you all for the interesting questions. it was my first reddit ama - was pretty intensive, and i loved it. and thanks for the amazing contributions in project discovery. ~attila thanks to the r/science mods and everyone who asked questions and has contributed to project discovery with classifications! we're happy we can do this sort of thing for science ~hjalti and the ccp team.",none,5
812e57d4-bd06-4796-afbe-f09424107147,"currently going to be a junior at my university, i’m majoring in math with a minor in physics. i really wanted to enter the competition last year but i thought i wasn’t ready for it. i completed the whole calc series, linear algebra, diff eq., and also group theory. i think i’m “ready” to take the test and see where i’m at as a mathematics student compared to other students. honestly i don’t know too much about the test but i’m really excited to take it. any advice on how to prepare for this exam? should i brush up on my calculus? i feel like i need to know some identities that are rarely taught, such as the other forms of e or weird trig identities but i’m not sure",none,5
a5c987c9-fcee-46bf-9d54-cb405ff64d3a,"wikipedia has a great list of nuclear power plants: however, their table does not include comission date. does anybody have a dataset of power plants (or even better: individual reactors) that includes their comission date? i want to make a graph of world-wide grow of nuclear power plants for my youtube channel :)",none,5
5eadb6fc-bb84-419d-9662-8f6d794f3f83,"the doudna lab's research on crispr biology led to the 2012 discovery of the mechanism by which small rnas direct the protein cas9 to bind and cut specific dna sequences within cells, thereby altering a chosen dna sequence and changing the cells’ activity in a programmed way. this work opened up a world of possibilities by providing a simple and effective means of making targeted changes in the genomes of virtually any cell type or organism. by supporting this research, the nih is achieving its mission to advance the promise of genomic medicine through the precise manipulation of genes at a scale and level of accuracy that is not currently realized. the national human genome research institute (nhgri), part of nih, has awarded a five-year grant to to the doudna lab to establish the center for genome editing and recording as part of the center of excellence in genomic science (cegs) program. the center is pursuing two technological goals: 1) the improvement of the crispr technology to enable more efficient, rapid and accurate genome alterations; and 2) the implementation of robust readout technologies to quickly and accurately assess natural gene variations, as well as the success of crispr gene editing. in addition to work through the new center, research efforts in the doudna lab include discovering the mechanisms of novel cas proteins and exploring new anti-crisprs which protect self dna from crispr cleavage. our goal is to harness the power of crispr to benefit humankind by curing disease and caring for the environment. we’d love to hear your questions about this technology and the new center of excellence in genomic science. ask us anything! **your hosts today are:** **jennifer doudna, ph.d.**, professor of chemistry; biochemistry and molecular biology at the university of california, berkeley and members of her lab **lisa brooks, ph.d.**, program director in the division of genome sciences at nhgri **dan gilchrist, ph.d.**, program director in the division of genome sciences at nhgri **lu wang, ph.d.**, program director in the division of genome sciences at nhgri **carolyn hutter, ph.d.**, acting division director in the division of genome sciences at nhgri **lawrence brody, ph.d.**, division director in the division of genomics and society at nhgri **nicole lockhart, ph.d.**, program director in the division of genomics and society at nhgri **mike smith, ph.d.**, program director in the division of genome sciences at nhgri **relevant links:** learn more about the center of excellence in genomic science (cegs) program: learn more about dr. doudna’s research: **update:** hi reddit-ers! we're wrapping up for today, but thanks for all the great questions! we're thrilled and honored that you find crispr science as cool as we do! if you want to see/hear more, dr. doudna will be live-streaming a chat with siddhartha mukherjee, author of the book, the gene **today** at 4:30-6 pm pt. see the event here!",none,5
9252a6af-2609-46dc-9910-21b56c3ec9b0,"okay, i exaggerated. it will take more than one election to fix our government, but on november 4th we have an opportunity to start repairing some of the damage that has been done to our political institutions and elect a house of representatives that is looking out for the best interest of the the american people. [every single one of the 435 members of the house of representatives is eligible to be [33 out of 100 senators is eligible to be [36 states will have the opportunity to elect a new what we have is an opportunity to end the obstruction, the filibustering, and the constant gridlock that we see in washington dc today. if you love your country and your fellow americans it is your *responsibility* to cast a vote this november, to not vote is to say that the status quo is just fine and that you see no need to change. * if you feel that students should be able to refinance their student loans then you need to vote, even if you're not a student. [(consideration of this bill was blocked by a republican filibuster in the * if you feel that we should replace the $7.25 federal minimum wage with a living wage then you need to vote, even if you're not a minimum wage worker.[(consideration of this bill was blocked by a republican filibuster in the [(a similar bill was unanimously opposed by all republican memebers of the house of * if you think that companies that outsource their labor shouldn't receive tax breaks for doing so then you need to vote, even if your job is safe. [(consideration of this bill was blocked by a republican filibuster in the * if you think that our veterans deserve expanded access to health care, education and job training then you need to vote, even if you're not a veteran. [(consideration of this bill was blocked by a republican filibuster in the * if you think that money *isn't* speech and that we need campaign finance reform then you need to vote, unless you're a millionare or billionare. [(a constitutional amendment that would overturn citizens united was blocked by a republican filibuster in the * if you're sick of government shutdowns and the [economic impacts that the american people suffered because of the then you need to vote, even if you don't have a government job. [(the shutdown was initially proposed by republican senator mike lee and republican representative mark meadows and supported by 99 other members of congress. all supporters were --------------------------- i'd also like to address some of the common concerns when i try to encourage people to vote: * ""they're all the same anyway."" * this is demonstrably not true. currently our political parties are more polarized than they have been in more than a century. if we look at [party-line votes in the and [the house of the distance between the parties are obvious. for the average redditor the differences between the haven't been as stark in our lifetimes. (these visulizations may be easier to read: [senate | [house * ""not voting is the same as a vote of no confidence."" * we have tried not voting before. in fact we have tried not voting sixteen times in the last seventy years. less than half of eligible voters turned out for midterm elections in [1950, 1954, 1958, 1962, 1966, 1970, 1974, 1978, 1982, 1986, 1990, 1994, 1998, 2002, 2006, and which means that in 100% of midterm elections since 1950 a *minority* of americans were allowed to pick a new house of representatives. * not voting is tantamount to saying ""things are good enough in my life that i'm going to let you keep your job"" because why would an elected official change anything if they're reelected? they don't care if they win with 100% turnout or if they win with 10% turnout just as long as they win. * not voting just gives more power to the people who *do* show up. * ""voting doesn't change anything anyway."" * nothing changes all at once but our history is riddled with slow but steady progress. we have seen since 2010 the damage that can be caused by a single election, how one bad election can slow progress to a crawl and even drag us backwards. voting *can* and *does* make a difference, but first you need to vote. * ""my vote doesn't count."" * no, your vote alone won't win the election. vote anyway. you; by yourself, won't win a tug-of-war, that's why we all work together and we need *you* to pull your weight, especially now. * ""my district is too much for the opposition to stand a chance."" * gerrymandering has no effect on state-wide elections, so if you don't vote because of gerrymandering you're missing out on the opportunity to vote for governor, senator and any of a number of ballot initiatives. * ""there's no one on the ballot that represents me, or represents my views."" * then you need to represent your views for yourself. go to the polling place and write in ""no confidence"" for any; or all, of the eligible seats. not voting says nothing but ""everything is fine, my life is good, i don't want anything to change"" so go and vote ""no confidence"" and make your voice heard. * ""if voting changed anything it would be illegal."" * for the vast majority of human history voting was functionally illegal, as leaders were picked through birth or war or appointment or god. the very thought of letting the people vote was considered dangerous and absurd. * when our country was founded it was illegal for anyone except white, land owning males to vote. * it was illegal for african americans to vote until 1870. * it was *practically* illegal for african americans to vote until 1965. * it was illegal for women to vote until 1920. * it was illegal for 18 year-olds to vote until 1971. * ""why should i have to choose between a douche sandwich and a giant turd?"" * i guess you should have voted in the primaries so that d. sandwich and g. turd would never have gotten to the general election... * also: no human is so black or white, no policy is so clearly right or wrong, no political party is so good or evil. the sandwich analogy is a painful oversimplification of both voting and of political candidates. a few good reasons not to vote: * you are confident in your neighbors ability to choose who represents you in congress. * you're happy with the way things are and you're worried your vote might change things. * ...those two are the only ones that i can think of. there are those who will try to tell you that they're too weak, that they're actions and votes are worthless, that it is better to sit in silence than to stand up and be counted; these people have become so convinced of their powerless impotence that they will try to convince others of the same thing. just like an alcoholic will try to force you to drink, the timid will try to force you to stay silent. smile and nod and vote anyway, because you are not weak, you are not powerless, you are not impotent unless you let yourself be. think of them like the fat friend that's always trying to convince you to eat cake. the biggest point i would like to make here is that yes, your vote does count. the person who convinces you not to vote, votes twice. ----------------------- **addendum: /u/trying2bawiseguy has made up a [complete list of competitive congressional elections where the candidate and incumbent are damn close. if you live in any of the districts listed in his thread make sure to haul ass to the booth on election day and also upvote his thread for visibility and spread the information around!** ----------------------- **edit: i am very pleased to see the reception that this post has received and have enjoyed the many micro-conversations that have been had in the comments below. i would encourage you to read through them and post your own whether you agree or disagree with the information here. i would also like to reiterate that it is up to you to get people involved and out to vote. make sure that your friends and family are informed on the issues and the candidates, maybe even volunteer to carpool them to the voting booth.** **don't stop here, get excited, or angry, or scared, or whatever it takes to get you to the polls then do the same for someone else. you need to be where political responsibility starts, not where it ends.**",none,5
