ID,post,class_name,class_id
d4295391-9ca5-4398-b7c8-687e4a984ef1,"i've recently requested testing accommodations at my university and was given letters to personally give to my professors. so i gave the first one i saw his and he was very nice about it. the next day i brought the next professor his (he probably thinks i'm a nut i'm always screwing stuff up in this class) and he was also very nice about it. shortly after leaving i receive an email from him: ""actually you gave me a form meant for another class and instructor. i can get it back to you on tuesday should you need it."" i had 2 papers to keep track of and distribute, i really thought i paid attention to which letter was which. i can't even help people help me what is this. i both cried and laughed my ass off",adhd,0
649a668a-4159-49cc-9db7-f4d172040d08,"just want to say how grateful i am to have found this sub, and how grateful i am for how active the community here is. when i'm feeling down, when i'm called ""lazy"" despite me working so hard in a lot of areas, despite me working hard to correct and/or work with my flaws, and it's just not seen or recognized - it's good to come here and read. i feel at home here, even though i'm not super active. i like to read here a lot. and i'm grateful for you all.",adhd,0
0b5bb230-afdf-40c0-9f03-e35aa473a46b,"luckily, i usually do count my steps when i lose my keys at work. it really sucks when i lose both at the same time. it's one of the things i seem to be known for..",adhd,0
289150ec-1ebd-44e0-9211-91feb57ef122,"all my life i’ve noticed that it’s hard for me to put time and effort into friendships, but sometimes i’ll even fixate on one person i guess until i move on to someone else. i never did this on purpose or to be hurtful, if anything i’ve usually noticed people move on from me if that happens. this didn’t really hit me until this past year when one of my friends called me out on this and even if it hurt at first i realized they were right. i also find it hard to have the motivation to see if i want to hang out with some friends and i often as myself if it’s worth the trouble or anxiety to try and do so. i just always worry that my friends might find me too overbearing or annoying since sometimes when i’m too happy to be around someone, i do get hyper. i guess my point/question is how am i able to find a happy medium with friendships and social skills that seems to come naturally for nts? it seems like they don’t have as much of an issue as those who have adhd/other disorders. i just want to be able to hang out with people more often (finding the motivation i guess) without worrying if i’m being too much or anything of the sort. (i also am in therapy so this stuff has been talked about but it also feel good to hear other adhders’ experiences).",adhd,0
7a94c538-d2e9-40a5-8595-72a8695263ed,"i'm having complicated feelings here. my husband is thankfully getting better but has been sick for the last month with what we suspect is covid. (he had a negative test, but has all the symptoms. we are in a hard hit area and i've never seem him this sick this long including 2 visits to urgent care / er. we just went for antibody tests today.) more recently he has been complaining of brain fog and feeling mentally slow and forgetful. for the last couple of days he'll make flabbergasted remarks like, ""oh my god! i walked into the room and couldn't remember why i came in here! can you believe that?"" and ""look honey, i set my water down here and i forgot where i put it."" and then, ""i went back into the kitchen for my water and i still didnt bring it back, just my coffee."" he says these things with a mix of disbelief and humor, while at other times he expresses a lot of anxiety about these and other symptoms. this is... such a mixed bag for me. i've been really worried about him and i'm really glad he's getting better. i'm still worried because he's usually very organized and it's true, any change in cognitive function can be a cause for concern. especially because he's been dealing with a ton of obnoxious and scary and ever changing symptoms for a month and counting. most of the time i've been reacting with humor as well. but i've also been saying - ""you mean you dont usually do that?"" and, ""you know, you are basically describing things that i do probably 20 times per day and have always done for my entire life. welcome to my level!"" it's strange to me that this seems so remarkable to him because it is so everyday for me. i am also having a hard time because, while things have gotten a lot better between us, we definitely have a history of him criticizing me for this exact type of thing. setting things down and leaving them because i've forgotten about them, getting off track and delayed because i'm not totally keeping track of what i'm supposed to be doing. he's always been the more organized and disciplined one. part of me wants to scream, ""now you know how it feels!"" of course, i dont know what it feels like to have covid or whatever bug this is since i didnt get sick, so maybe we're like even?",adhd,0
d6baf229-9e9b-4ef6-874a-42bba4dcd2e5,"i wasn't diagnosed or medicated for adhd until age 30. i always thought i was just lazy and anxious. i realized recently that whenever i feel sick, it takes a long time before i believe that i actually am sick. i'll feel tired and run-down but then i'll think ""maybe this is just my adhd low dopamine/motivation."" a lot of times, i end up pushing myself too hard because i can't tell when it's my body saying, ""enough!"" and when it's my brain saying, ""i'll do it if you can kick me hard enough."" just wondering if anyone else relates to this.",adhd,0
36522d33-91f0-4aa7-ac47-ee1049bc916f,"adhd has got some kind of nerve, you know that? what is the number one most important thing that i need in order to function near baseline? sleep. what does adhd make needlessly difficult? sleep. i swear, if i have to go through another day where i'm dead on my feet and then totally wired the moment my head hits the pillow i'm gonna throw something. nothing exacerbates that feeling of ""being a prisoner in my own mind"" more than not getting enough sleep. i can't do *anything,* and instead i just sort of watch my body lurch from one bad decision to another. ""why yes, i'll continue to gorge myself on junk food and watch shitty youtube videos instead of getting actual work done."" it also has the added benefit of making the meds useless, so hooray for thumping side effects with no actual benefit. if i don't prioritize sleep, i can basically guarantee that *nothing* i'm supposed to get done the next day is happening. finally, as the added *coup de grace,* lack of sleep makes you procrastinate on everything, *including going to bed to sleep.* i swear, talk about a disorder of vicious cycles.",adhd,0
8e6fdd2d-bf9d-47b2-ba8f-62eafc5e8aaf,"my 8 year old son was formally diagnosed with adhd earlier this week and prescribed vyvanse. i have been in almost daily communication with his teacher this year as we've tried to help him get through the school year, so i let her know that he had taken his first pill this morning. she sent me feedback this afternoon that he worked great in a group today, he wasn't distracted by the other kids around him, and he found something out of place at recess and put it away which is incredibly observant and out of character for him. he also got all his schoolwork done on time, which is a major struggle for him. when he got home, he told me he felt smarter today and i noticed immediately that he isn't getting distracted in the middle of his sentences and taking a lot longer than others would to say what he's trying to say. he seems more direct. and guys.. i'm freaking crying. this is the boy i've always known he was, coming out of the fog. i'm sure this is not the end of his journey with learning to live with adhd, but it seems like a milestone. the fear and worry that has been weighing on us both as he fell farther and farther behind his peers is a little less today and i'm so thankful for it.",adhd,0
0399c24f-f891-4ef9-adc1-8cac4aad0c75,"sometimes you just have to laugh at how ironic this disorder is. i can't stand listening to someone talk about something for longer than 15 seconds without hearing the point, but i also won't shut up when i'm talking about something i am passionate about or hyper focusing on and it's just really quite funny how this is both sides of the coin. it's a frustrating thing to deal with, but man it helps to just laugh at how stupid it can be, to just find some light in the dark.",adhd,0
2a763e3f-e93f-4702-b36f-0751a8b56e5a,"and not for the reasons you would usually think. i feel like because 1) my memory is terrible, 2) i think of a million things at the same time - all outcomes, all variables, all aspects, at all times, 3) this is all more intense in critical moments which usually involve anxiety, important decisions, other people, important stuff; and 4) i have a difficult time _remembering_ who i was and why i did this or that... because of these adhd traits, whenever i have to make a difficult decision, i think a million ways to justify it, a million reasons to do whatever i am deciding to do. and then later, when i regret that decision and get confronted by life about why i did what i did, i always find a way to select, from within the million reasons that went in my head in the critical moment, a reason that better suits _my current situation_. and i can make an horrendous crime seem like a completely reasonable and understandable act. then i feel like i'm manipulating people. and i have no way to decide if i am telling the truth to them or not, because i could be deceiving myself to begin with. i could have done whatever i did for completely egoistical reasons, and then later, when i see an oportunity to reframe that, i take it without even thinking abou it. this is a riddle i will never, ever solve. i'm doomed to feel like i'm a disgusting egoistical manipulator. and i'll never know if this is because i have adhd or am just a bad person. and i'll feel terrible for maybe be a terrible person who uses his condition to justify his acts.",adhd,0
0d29d7b2-814d-4331-b054-d011a5e42b34,"i have always struggled to sleep since ever. and when i started medication this only got worse. i quit medication a year ago, and sleep got slightly better. but it would still take me 2-3 hours to fall asleep. then, about a month ago i hit a brick wall of stress, guilt and bad planning. i went on sick leave for 2 weeks. during that time i improved my workflow / todo list and i started meditating using the headspace app. (ios) the app teaches you to relax and be mindful. basically it tricks you into calming down. and two weeks into the training, i started falling asleep without effort. none. i just do the routine from the training and i fall asleep. it is like magic. sorry. but this is a huge thing for me. maybe it can help you too, so i wanted to share. and just as a disclaimer, i have no idea how or why this works, or if it's some placebo effect. but at this point i don't care. because now i'm even more calm and less hot headed during the day. and i can sleep at will. at will!!! :d and one more disclaimer: i've read multiple sources say that this kind of meditation can surface buried mental issues / traumas. so that's something to keep in mind if you want to try it out. edit: just to clarify. this isn't a learn how to sleep app. it's an app that teaches you to meditate. and it's that knowledge that has enabled me to sleep, not the app directly. i don't use it at night.",adhd,0
9bb70053-9d0f-49b0-9c2a-940ae812b0a7,"went to get a bowl for the batter. ended up putting away all the clean dishes. went to get flour. organized pantry instead. went to get carrots. cleaned fridge from a small spill. went to turn on oven. cleaned grimy stove went to start making muffins as per the plan. made reddit post about it instead. all in all, i'd say it was a successful day.",adhd,0
b962ec8e-d92d-496e-985a-141b9784b8d3,"hello r/adhd! as i’m sure many of you know, it’s hard to research symptoms and manifestations of adhd since they depend so much on age, personality, and other complex traits. i’ve been thinking lately about symptom masking both in childhood and adulthood. i’m diagnosed as adhd-pi but as i get older i really want to make sure i understand the totality of my condition. to be specific, i would like to know how hyperactivity symptoms might manifest differently than the stereotypical way in someone such as myself: -female -generally intelligent/academically successful, at least in subjects which are of interest -coasted in school but never due to being able to pay attention ;) -quiet/introverted, not verbally impulsive can anyone in the same or similar boat comment on which, if any hyperactivity symptoms you have noticed in your childhood or in present day? how do they affect your life, and do you find that medication helps? thank you- your wisdom and thoughts would be so appreciated!",adhd,0
a9867565-9123-422f-ad78-db749482e2e3,"my husband laughed and commented to me yesterday that he feels like we have a child in our home because all of my “toys” (aka, unfinished projects, color pencils and drawing supplies, video game controllers) are strewn across our living room. conclusion: he is not wrong. i giggled, dug in my fridge for a cheese stick, and sat down in my mess and played animal crossing.",adhd,0
8c0b3da0-08b3-47e2-b6e7-c8aff952b338,"so it finally happened. i couldn't keep putting out the little trail of fires i was leaving in my work and they just caught up to me and burned me out. however... i'm reacting a lot better than i thought. i told my company about my adhd after i was diagnosed. i was diagnosed just before christmas and i told them shortly after. i was being completely honest with them, i told them i wanted to have it out in the open, and for it not to come up during a situation where it would seem like an excuse for something (at the time i was holding things together quite well) they were quite supportive and they asked me for info or advice regarding it. afterwords i was able to get back into a really productive flow for about a month, i was working so god damn well and i was the happiest i'd been in a while in regards to my work. i couldn't keep it going come the start of february. things started to slip and i basically shut down. i was so worn out that i was getting constant headaches and i felt physically sick. i'm not on medication so it wasn't a side effect or anything, it was stress. i was trying so hard to keep that enthusiasm and that level of work. cut to today, i had a meeting with my manager and we were talking about the past month, all the slip ups and issues that happened. things i honestly thought i had done, but were embarrassingly not even partly finished. she handled the situation very, very professionally. we spoke about the fact that it is in no way a reflection of my character, she said i'm a very good fit in regards to the teams dynamic. but that the inconsistencies in my work were a problem, which is fairly obviously true. we're a client facing company, my inconsistencies and my slip ups have a major impact on the reputation of the company itself. so after some more discussion we came to an agreement that for both parties it would be better for me to leave. i understand the role, i know what this job entails, and i do agree that it is the right decision for myself and for the company at the current time. i like to think when i get things under control that i could come back and truly be able to do my job consistently, i like the team, i like the perks of the job and the experiences that come from it. i'm going to use this as a reason to really evaluate what i need to do with myself. this is the first time where my adhd has put a roadblock in my way as opposed to a hurdle. so i'm going to use this time to either find a way around it, or i'll just find a better road.",adhd,0
be1ea12b-b532-474d-afe4-2b5686667bec,"especially since i was diagnosed as a child all information went to my parents instead of me so i have this disability that i really dont know about except the “have a hard time focusing/finishing” and i really thought thats all there was to it. recently i’ve been talking to others and looking at groups/forums (like this one) of adhd diagnosed and my mind has been blown about how much it actually impacts my life. it’s a little upsetting to find out so many years after my diagnosis that its not just school work related/focusing, but emotional regulation and mood swings and all the aspects of executive dysfunction and social skills! it’s this huge revelation thats come onto me and to be honest its overwhelming. like i’m happy that things in my past and present now make sense but its also another mountain to climb, now i have to figure out a whole new side to me that i thought i knew... i just wish this was talked about more with me or given a heads up. tl;dr never told what adhd actually entails, especially with emotions and social skills. just found out recently in my own time.",adhd,0
532ccd35-cddc-4e43-8913-38d2d8491143,"i am in desperate need of a hair cut and colour. booked an appointment two weeks ago. put it on my calendar. put an alarm on my phone. remembered to do a skin test 48 hours in advance. remembered the appointment this morning. sat down to play a computer game 2 hours before the appointment. came out of hyperfocus an hour after the appointment. phone was on silent next to me. i feel guilty, my stylist is probably annoyed with me, and now i’m going to have terrible hair for 2 more weeks.",adhd,0
14dc9d66-4bfd-4a41-9fd7-e607cf1ecea7,"sometimes i'm having a hard time to recall some words during conversations, i stop for one seconds try to remember that word or use synonyms/english translations (i'm bilingual). i made a research about this issue and found out that adhd, being introvert or bilingual can cause this issue.",adhd,0
856e4a53-7576-4e94-a2b7-99926ab76190,"it's like skimming.... but with your ears. no but seriously, i have a really hard time focusing on and processing any auditory information. some examples: * in grade school if instructions weren't written down, i always either looked to the kid next to me and tried to figure out what to do or straight up asked them/the teacher to repeat what i was supposed to do privately. * i took spanish for 12 years and could read, write, and speak it fluently, but scored significantly lower on the auditory comprehension exams (which are relatively accent-less and slow). * in college, i never understood what was going on in my engineering lectures until i looked at the same words on a textbook or unless the notes/slides were pre-written. * my boyfriend pre-watches west world and then has to fast-forward through all of the ""boring"" parts of the episode where there's a lot of dialogue, pausing and playing at brief snippets of the really important stuff so that i understand what's going on. (if i watch alone, i just use subtitles and i'm completely fine watching it normally. he doesn't like subtitles). * in meetings someone will say something important and it just will completely not register, and i just have to frankly be like ""i'm so sorry. i missed part of that. can you repeat what you just said after... (blah blah blah)."" **anyone know why this happens or ways to cope?** i'm not a *dumb* person. i graduated college with a double major in chemical engineering and biomedical engineering from a top 10 engineering school (recently. i'm still proud. let me proud :))))) )... but meds don't help with this either. it's embarrassing, since some people are clearly annoyed with having to repeat themselves... which, ultimately, is whatever except when it's my boss and then i don't ask them to repeat themselves because i don't want to annoy them, but then i end up just having to go back 15 minutes later and quadruple check that i understood everything important...",adhd,0
ab69dbf7-db78-480d-ab7f-ec48ffeb1350,playing video games off of my medication is very dangerous for me. this weekend i started a play through of spider-man on ps4. if i was on my meds while playing i would've finished the game in a couple week. i finished my play through in three days with 100% completion. i've never done this before but it was oddly satisfying to just sit down alone and do something i enjoyed to the extent that enjoyed spider-man.,adhd,0
c3f36a9e-354a-4e65-9ba3-c80f03820d22,"i am hearing more and more about this new wonder drug for adhd and i would love to see people document their experience with it. remember, don't give any medical advice, simply state how it affects you and your adhd. thanks edit: the reason why i posted is because i have had stronger stimulants before (dex, adderall, concerta, etc) and it seems the cons outweigh the pros. modafnil is the next step i want to take as it interests me. i do notice though that there are some mixed reports, with some stating it doesn't do enough and others stating that it's perfect, and even some saying that it's really bad. guess i will find out for myself. i can't continue abusing amphetamines and i can't continue this way at work with not focusing. here we go!",adhd,0
0db5bc85-982d-4ab5-9efc-86bd4695c680,"im pretty new to this adhd/ add life. i was recently diagnoised in the last year at the age of 22. i bought self help books because i though hey, this can help me! but i dont ever read them. i should probably start therapy back up lol...",adhd,0
e81a140f-8621-4628-803c-58beb80c2ed1,all the ideas that normally disappear as soon as we reach for a writing device will be captured and started. imagine all the projects we will begin and never finish!,adhd,0
4a057222-cf39-4369-b399-ec50300c595b,"this morning i took the last pill from my old prescription with my breakfast and went about my day after throwing my new prescription into my purse. at lunch time, when i went to take my second dose, i realized that the pills were shaped differently so i stopped to inspect them and that's when i realized that they said 20mg instead of 30mg. now, i have no idea what to do, so i call up my pharmacy, 15 minutes left on my lunch break, and i tell them my name and dosage and medication and that they gave me the wrong meds. in this circumstance, i believe i did the right thing because while they sounded a little freaked out, they told me they would send someone over to my job to swap out the wrong meds for the right ones. thankfully everything went smoothly and i was able to get the right medication from the pharmacy worker and she took the wrong medication. now, if any of y'all are like me, you may be a little unobservant, but this is just a reminder to check out your meds and call your pharmacy if you think anything is wrong.",adhd,0
ffbe4c08-8697-42e6-8a5e-75b97a41b1d5,"i think it stems from that whole ‘perfectionism’ thing. like, oh you didn’t finish the reading? there’s no point in going, you’re just going to look dumb and your professor will know and be disappointed in you and think you’re dumb and also hate you. same thing if i don’t finish an assignment, or am running later than usual. “oh you didn’t finish that response? might as well fucking drop out, you loser. you’re running late? who cares that you’re practically expected late, today you’re 5 minutes later than usual, what’s the point in going. you suck” feels like i’ve already failed at the whole thing so like, why even show up. i tell myself, “it’s alright, just don’t do it again, do your assignments, show up to your fucking classes that you actually really like; today’s gone to hell, but tomorrow we will do it differently.” but then next day comes and i don’t. its really frustrating. and it’s not like i haven’t read that novel twice before this, or like i have to present anything, or do much more than show up, listen to my actual brilliant professor talk about a novel i really like, take notes, wish i could b her, and leave. any other students here struggle with the same thing? any help, or echoing complaints would b nice",adhd,0
449ec5c3-9959-44d3-9865-2ca73b185f14,pretty sure we can all relate to procrastinating the tasks that we have zero interest in but how come i do this with the things i also really want to get into? i either waste my time in hyperfocus or i'm just playing games. it seems like hyperfocus is dangerous for me because i hyperfocus on the thing i want to do and i just end up researching tons about the things i want to do before i actually start committing to them. does this happen to anyone else and is there anyway to force myself to just break out of that cycle and start doing?,adhd,0
797a57f1-8040-48ad-b797-3144bdf69574,"i am an all or nothing girl... black or white thinking, there hasn’t been any middle ground for years. diagnosed sept 2019 with adhd/dyslexia. the doctor keeps telling me to do things in small chunks of time so i feel over whelmed and the tasks don’t seem so huge and daunting. well i did it! i broke my cleaning the condo down into sections taking a break between each section and guess what the entire condo is clean, tidy and organized.",adhd,0
097c4cac-d4b9-4a44-b5f2-bf31ddb8e5d6,"i have been told by a credible source (read: acupuncture student) that adhd can be cured with fruit and vegetables, and some exercise to burn off excess energy! well hallelujah. i can turn in my prescription after all. i'm sure the last three jobs i've quit after less than 6 months, despite regularly jogging and eating well, were just flukes. i'll be much more successful next time! sorry to rant, but where do these people get their science from?!",adhd,0
