ID,post,class_name,class_id
8a35cce2-22aa-4715-986c-6b29843af4e0,"my boyfriend and i have been friends for nearly 2 years and have been dating for four months. yesterday was the first time i had an anxiety attack in front of him. he has known that i have anxiety but he's never seen it first hand. well yesterday, i was hanging at his place anime on his computer when all of a sudden my anxiety overwhelmed me. i went to his bathroom for a minute hoping it would pass and then i broke down, i realized that i had been in the bathroom for too long so i quickly washed my face and went back out. even though i had washed my face it couldn't hide the redness and puffiness of my face. at first he didn't see it because i was on my phone and hid my face with my hair, and then he laughed and pointed at the screen and looked over at me, immediately paused the show and went ""are you okay?"" that's when i pointed at my chest and through very narrow breaths said ""i'm.... having... an .... anxeity... attack"" he asked why, and when he realized i couldn't talk he grabbed my hand and rubbed methodical circles. throughout the rest of the attack, if i told him not to touch me he'd lay off. if i told him to touch me he'd wrap me in an embrace. he even pointed at me and looked at our dog and said ""mom's sad. give her love"" to which our dog jumped on me and gave me dozens of kisses. i just... aghast. i'm so happy he reacted the way he did. but in my head i thought he would have hated seeing my attack and would've reacted differently. i'm so happy he took it the way he did and i'm surprised as well. but goddamn i love that man. &amp;#x200b; tl;dr i had an anxiety attack in front of my boyfriend and i thought he wouldn't reacted badly to it, but instead he held me if i needed it and backed off if i needed it and i really appreciated it",anxiety,1
b172c95a-db3f-4cb9-9064-36b7e333e2d7,"sitting here, at 4:03 am, trying to make up a comprehensive thought in order to ask for help on this subreddit is so fucking challenging to me. i'm sure others feel it, too. i want to ask for help, but it's so challenging to do that. i have no fucking clue how i'm supposed to be an actual person in the future, and i need to ask for help with such issues in my life, but it's so hard as i don't have a good home life. i can't do this on my own, and while i do often confide in my girlfriend, it's so hard to be alive. thank you, i hope you all have a good night.",anxiety,1
d5aae547-236e-4958-8a1b-030334bca163,"being anxious about a thing for no other reason than 'i have an anxiety disorder' is a valid reason to be anxious about the thing. i find myself going along the self hatred route when i don't have a logical reason to be anxious about a thing, with thoughts along the lines of 'wow i'm so pathetic for feeling this way' and 'what's wrong with me this is so stupid i shouldn't be having a problem with this thing!' these thoughts aren't helpful. these types of thoughts have never once helped to motivate me to make a positive change in my life. the only function of thoughts like these is to make myself suffer because the depression side of me says that i need to make myself pay for being a bad person. (also illogical and untrue, but that voice is still there) what has been helpful are thoughts like 'well i legitimately have an illness, that illness is a perfectly good explanation for why i have anxiety'. the less i beat myself up internally the more progress i make in my life, which honestly still doesn't make much sense to me but it's working so i'm gonna keep going with the being kind to myself thing. :)",anxiety,1
3d60d7c5-4edc-4932-ad1b-e8fa0299a22a,"this is just a rave i guess.. seriously. it's freaking moving for me. sometimes i reddit during my lunch break at the desk and have well up secretly. i know how hard it is to stand up to your anxiety and grapple back some control, and i can just picture each person (my imaginary images of you guys) feeling victorious. if anyone else was reading this and saw that somebody had the courage to take their medication, or leave the house, or get a job, they would laugh. but me, i absolutely love reading these stories. they are empowering. and to anyone else struggling, i hope you find some kind of empowerment on this sub too.",anxiety,1
8d4d1d61-8e11-442c-a41e-86336005693e,"i went last week for the first time in forever, and i left feeling like i just took a xanax. it's scientifically proven to be beneficial for the mind and body. therefore, in the words of the great shia leboeuf: do it! just, do it!",anxiety,1
970231ed-4529-4f0c-acfd-2287a2b4ab85,just have to work 12 more days and i'm free. i've wanted to kill myself for the last 3 months thanks to this hellhole and it only gets worse day by day. my contract is over on the 15th of may and then i'm free. i'm fucking free. i'm so close now.,anxiety,1
e22ee75c-1294-46ad-8492-bd2261a82b11,"i don’t really have anywhere else to post this, or anyone to talk to about it. i had a bad panic attack today, one of the worst in a while. luckily i’m working from home, so no one noticed, but it hurt a lot. extended hyperventilation, body spasms, and lots of coughing. and now my mind isn’t working right, and i just wish this didn’t happen to me and i wish i was happy. and i wish my head didn’t hurt. my boyfriend is under a lot of pressure right now and he’s definitely stressed. he’s always so good to me, i want to be strong for him in the coming days. so i’m gonna do my best to put on a happy face, i’m going to listen to him, and i’m gonna tell him happy things. i haven’t told anyone in my life about my attack today, and i’m ok with that decision, i just wanted to tell someone. thank you.",anxiety,1
2f55fe7c-99c0-4a8a-bdda-ab2ab75b55bf,"i'm not sure how else to describe it. i know a lot of people might get morning blues, but mine feel very intense consistantly. it usually takes a couple hours to come out of, but while i'm in the depression i just seem to hate my life and myself. is this normal for some people? it's been really bad lately. i don't want to complain about it to people in my life because it feels so trivial and that they'll just say it's nothing to worry about or something. any similar experiences here? it would just be nice to talk about it a little. thanks guys!",anxiety,1
0fc189ff-99ce-45af-add8-32d976087b29,i made it through the whole day and i fought those negative thoughts and i won! now it’s only 5:30pm so it’s not all over it’s still going but i did it! i’m so proud of myself and i’m just really excited this is my first day fighting my anxiety and i’m determined to win!,anxiety,1
e4b20da7-5aff-460b-b199-7f2ccd698c79,"like i love summer sunsets and sun rises, i love the smells of bbqs and sunscreen, i love not having classes in session, but i hate the heat. i also hate it because i have way less awesome excuses for laying in bed or on the couch instead of being outside and wearing skimpy clothes or bright colors. idk, i'm more of a cold-ish weather person bc i like to cover up and be inside by myself",anxiety,1
0398c59d-e8f4-4597-8d59-08b905c9f931,"last week i could not catch a whink of slrep, 6 days. one night i finally got aome sleep but woke up seeing unreal things like people and cars. today, i couldnt even tell if my parents were real good luck to me, i guess.",anxiety,1
baaef464-af14-4fab-b247-c848bf050f76,"at 21 years of age, i finally got over my anxiety and applied to jobs to try and get some work experience. i have applied to jobs before but was always too nervous to follow up. i called to speak with the manager to show i was interested (i hate phone calls), was offered an interview the next day, freaked out all night over how i am going to mess it up, then was offered the job on the spot! my first day is tomorrow and i will have a lot of things to learn and i am sure i will be under a lot of pressure, but i am damn proud of myself for finally doing it. nothing i have done so far was nearly as bad as i expected it to be. just wanted to remind you all of that :)",anxiety,1
3f76c41a-8eec-402a-be33-c2fe203fc02f,"i've hated my existence for as long as i can remember. i feel so inferior to other people. whenever i accomplish something that i'm proud of, i'm usually too ashamed to tell anyone about it because idk, it might hurt someone's feelings i guess. i'm hypervigilant around people, especially people i'm close to. i also feel responsible for everyone's emotional reactions even though they often don't have anything to do with me. i'm overly desperate for everyone to like me. idk i can't live like this anymore",anxiety,1
fc60a03e-6d46-449b-b9b1-e3dede9deed1,"i'm not sure if this is the right place to post this so if it isn't please remove. for as long as i can remember, i've had this urge to defend every action, choice, and thought i make inside my head to a non-existent person who is judging me. i don't know if this is a form of social anxiety but i end up becoming extremely conscious of everything i do, but not in a good way. so i just wanted to know if anyone else experiences this. thanks.",anxiety,1
a1362304-ff8a-42a7-b9ad-a8b9c6ebceff,i'm going through some anxiety again these days. i guess i'm gonna try to diversify my activities to be able to enjoy things and appreciate the free time i'm having. it just sucks at the moment.,anxiety,1
927ebc60-ad0a-42ea-baf8-61edf824aa3d,"i’m sure a lot of you do, but i’m just having a shitty monday and feeling extra depressed today for some reason. i saw it’s going to rain for the rest of the day once i get home from work, i got really excited and i can’t wait to sit at home to watch and listen to the rain to calm me down, it helps so much. i hope you guys are having a great monday.",anxiety,1
9f50ea59-49f6-4055-aca5-c9f20fe5b18c,"for most of my life i've felt nervous. i overthink everything, i'm socially anxious. but lately there have been physiological symptoms, mostly tension in my body resulting in a lot of back and neck cracking, shortness of breath, irregular sleep patterns, and increased heart rate, especially after drinking. the other night i drank four beers, napped for an hour, and when i woke up i realized i couldn't go back to sleep because my heart was beating fast. my brother said he gets this too. also, intrusive, repetitive thoughts are becoming common for me. then i think about how this must mean i have an anxiety disorder. then i worry about having an anxiety disorder. it's a never ending cycle. another weird thing, i love music, but songs get stuck in my head and repeat ad nauseum constantly in the absence of external stimuli. does anyone else get this? i always thought this happened for everyone, but i don't think it does. it's like my mind is never quiet. it's either always worrying, talking to itself, or playing a song ad nauseum. i think it's time for me to see a professional and maybe get some medication.",anxiety,1
e3b29973-d00c-4f76-81fc-2ef525e7110a,"repost from the ibs subreddit. i just started running 3x a week. i run for 10 minutes and then i do some push ups, pull ups, crunches and jumps. strech and go home. i think i'm using 45 minutes in total. i do this with my father sometimes. i find that my anxiety levels decreases for that day and the next, and my ibs gets a bit better. with time i might be able to run 15/20 minutes. i get tired easily, never liked running more than 15 minutes, but still it makes a difference i think. just wanted to suggest that to you in case it helps you too.",anxiety,1
f94891b1-c58c-4842-96ea-f4ec9a9deb15,"i have always been a crier. i hate confrontation, and any strong emotion brings on the tears, even when they're inappropriate for the situation or how i'm feeling. like this morning, my boyfriend confronted me about leaving dishes to soak overnight. for context, our dish habits are foreign to each other. he likes things rinsed thoroughly and set on the counter to prepare for washing, while i grew up soaking things in the basin before washing to make it easier and save counter space. i usually accommodate him, but yesterday, i felt like shit. depression and anxiety had me at the throat all day and i just wasn't thinking about it when i left the pots to soak. naturally, he was upset and talked to me about it. he was perfectly reasonable and kind. i knew i messed up and apologized. he apologized for ambushing me, gave me a hug, and it was fine...except it wasn't and i was holding back tears the whole time and immediately started crying when he went to the bedroom. it's like i can't not cry because if i hold it back, it just eats at me for the rest of the day. i hate that my anxiety makes me so uber sensitive. i'm learning to live with it, but it's still embarrassing and hard to explain to people. especially since i'm a bartender - if you're in the service industry culture, you know that there's a lot of pressure to be tough and impervious to negativity. i've been denied promotions at other jobs because some nights, i've had to remove myself for like \~15 minutes just to screw my head back on. it suuuucks... thanks for reading my vent, if you did. if you deal with this too, then you're not alone and i love you.",anxiety,1
f1022eea-4885-4511-8b54-aae4a278b4d7,"i'm feeling like this right now since friday and it makes me even more anxious. the feeling is not as bad as being nervous ten minutes before a presentation or something, but more like a constant faint feeling. i have something big coming up on monday so that's probably the reason. i know it will pass but i don't know what to do right now.",anxiety,1
ddfe2ee8-998d-497e-bcaa-6d1012752ef5,"‪3 days in a row with panic and several times a day. will i ever feel like myself again? i just feel this knot in my throat all time. wish i could break down and cry but seems impossible . i can’t stop thinking that i’m ill and going to die . i’m too aware of everything i feel in my body. i just want to feel normal , go back to the days when this never occurred. someone just tell me i’m not dying , that i’m ok .",anxiety,1
c253e29c-2676-4309-bb9c-31d9cc0856f4,"my social anxiety is bad but still pretty manageable. however, when i need to talk to someone on the phone, it's like i instantly start having a full-blown panic attack. it seriously makes me feel shaky and sick at my stomach for the entire rest of the day. :'(",anxiety,1
e8f337d7-ceb4-4889-98bc-f908e2de1ace,whenever i’m with people as soon as the interaction ends i’m so embarrassed of my actions and the way i acted even if i just had a simple conversation.,anxiety,1
f6292df2-29df-4d06-9a35-f3f1489bf7a9,"does anyone else get super anxious when they have plans everyday? like, i'm a full-time student. i have class four days a week, and when i look at my planner and i'm doing something all seven days of the week, i feel panicky. even if the weekend plans are just spending time with friends, i still get anxious as if it's work, because going out feels like work. does anyone else feel this way / how do i stop? i used to take a day every week to just do absolutely nothing at home, but obviously, that's not realistic or too healthy.",anxiety,1
3e6c03cf-751e-4164-a7a1-970abaa31519,"i have sleeping problems, dont know if its insomnia or not but usually it takes me hours to fall asleep and everytime it happens i get super anxious, i worry that i will mess up my sleeping hours and will have to suffer and make myself stay up for a whole day just to fix them and worrying so much makes it even harder to fall asleep which in return causes more anxiety. anyone else?",anxiety,1
e0a67e50-9f9c-415c-9cc6-a698ec10fefc,"it can literally be something as small as which color filter i like better on a picture. (i like photography and playing around with edits). or which piece of jewelry i want to order online or something. something that small. i will usually get stuck trying to choose between two things, and will agonize over it, going back and forth, losing sleep over it. if i decide on one thing, i change my mind shortly after. i can’t tell you how many times i’ve ordered something online, and went back a few hours later to ask to do a different color or get a different pattern, etc. i literally sit for hours and agonize over small decisions like this. it’s almost like it gives me a panic attack. anyone else do this and know ways to cope or know *why* i might do this? it’s extremely frustrating.",anxiety,1
9be99593-a521-486c-89bb-d2cb09a6fbba,"..which is kind of how i feel right now. and i'm feeling so pissed off with everything to the point where,say,a asteroid wouldn't be so bad right now. i just feel so fucking trapped(and of course suicide is flatly out of the question) and it looks like everything is going to go to shit and there's nothing anyone can do to stop it. sometimes you wonder why you were even born.",anxiety,1
5bf7a9d1-ccf9-4d61-b8b0-b21c441f4dac,"4 people in my family talked to me today and i live with them. another wished me a happy birthday but mainly because i told them the day before. i even forgot to remove my birthday from facebook this year like i've done all the other years, so people and classmates could perfectly well see that it was my birthday. *i* don't care about birthdays but i know that *others* do and it hurts to know that they didn't care about me enough to at least aknowledge it. (should i mention that several people in *my* classes, whom they've never met irl, shared my birthday today and they were perfectly able to congratulate them) my dad really wanted to do something out of my 20th birthday but i just wanted to stay at home, however i agreed to go out to eat except every restaurant was fully booked and we ended up having to go grocery shopping at 8 in the evening. ended up with good dinner, but a mom storming off because of a ""cheap and bad steak"" or something like that. then everyone fell asleep at 9 and i watched iron fist the rest of the evening. it just sucks and and i am super fucking anxious about this year. in 3 weeks i am having surgery and the last cancer screening because the docs think there might be something super serious wrong with me. keeps me up at night. worst part? my mom thinks i am making it up and is constantly hinting at me that all my """"symptoms"""" would go away if i would stop... (and then she does a derogatory sign for being gay) i am starting uni next year and i was supposed to work this entire year but every time i try to hand in a resumé my social anxiety makes a mess out of everything and i get humiliated and rejected again. i have handed in 30 resumés or more and i live in an area with no jobs. idk if my dad thinks i am a pest living in the house, but i can see it in my mother's eyes. everytime i hand in a resumé and don't get an answer, it's like she believes that i've never handed anything in or that i am lying about actually getting a job. especially now with the surgeries - i have to lie down for 2 weeks after each surgery and idk she just hints all the time that i made up the symptoms to get these surgeries to avoid getting a job - since it's so convinient that i have to get these surgeries right now. --- sorry^for^ranting edit: sorry^forgot^to^post it's 2 hours ago, now :/",anxiety,1
251678d1-f72c-4aae-a260-d1c54923484d,"tldr: **i keep crying at work, how the hell do i stop doing it** i'm 17, fresh and new to the workforce. i also have to deal with anxiety and often i look super stupid at work because i'm internally panicking at work. so as a consequence i'm frustrating myself and most importantly my bosses and colleagues. when i get confronted i always have to pick between running out of the room or tearing in front of them. it's so embarrassing and frustrating. please help my anxious ass.",anxiety,1
f9dd1fd9-3adc-4ffe-a698-a620bfc58475,"i've suffered with bipolar disorder my entire life, but only began having major anxiety over the last two years. this is paralyzing anxiety. full body tremors, inability to eat in public, decline of most personal relationships, poor work performance, etc. i have been dating my boyfriend for 3.5 years and he's never once judged me for being so unstable. he's caring, patient, and kind. lately my anxiety is the worst it's ever been and my apartment had fallen into decline. i came home from work and my air conditioner wasn't working. every time i tried to call my landlord i couldn't. the thought of someone coming into my ""sanctuary"" was too much. i was hysterical and just dealt with the heat. (i live in the south where it's currently in the high 80s temperature wide). a week had passed and i wouldn't let my boyfriend come over because it was so hot. on thursday, it had been a week since my ac broke, i came home and my apartment was cool. i texted my boyfriend (the only other person with a key) and asked what happened. he taught himself to fix air conditioning units in 3 days, came over after work and fixed it before i got home. i was speechless. i cried for about an hour because i was so thankful. i've never had anyone be this understanding. i've never really had a healthy relationship before him. just the fact that he would do this because he knew how i was suffering made me feel the best i have in months. i'm currently cleaning my apartment for the first time in months because i feel calmer than i have in a long time. anyway, i just want to let you all know that our anxiety doesn't have to prevent us from finding love. they are few and far between, but there are people who will understand and lift you up rather than brush you off or think you're ""crazy"" for being anxious about every day things.",anxiety,1
3f6028e4-83d6-4bb1-96d6-787d8c8baa13,"it's been a rough few weeks. i started zoloft almost 3 weeks ago, and was doing ok actually for a bit, but the past few days i've been really down and anxious. i keep thinking to myself ""why are you like this? what am i doing wrong?"" and i know it's not all my fault, but as i was showering i realized something. i'm doing literally nothing besides taking my medication to help myself. i have a long list of things i planned to, or started to do but haven't in the last week. things like eat clean, daily journal (recommended by my therapist), read ""when panic attacks"" by david burns, exercise, meditate, and try natural remedies such as kava. literally haven't done any of those in the past week or 2. last time i ran was 2 weeks ago, last journal entry was 10 days ago, haven't read the book in a few days, haven't been drinking water, ate $10 worth of burger king at 11pm last night, and put off ordering kava. all i've been doing is playing xbox and being sad. no more of that. if i keep this up i'm just going to continue to go down the hole. i ordered the kava, i'm going to read my book tonight, going to try and go for a run after work tomorrow, picking up some healthy snacks, and i'll probably meditate before i go to sleep tonight. just wanted to share, sometimes it takes a long hot shower to realize you have the tools to get better, you just have to use them. at least in my case",anxiety,1
7bc07251-8361-403e-a044-177d81f74ea4,i do this too often. a friend comes over and as soon as they leave i rethink everything i said and will even think about it the next day. i'm always thinking about certain people. it just doesn't feel like my mind is free. i just wish i had better control over my thoughts in general and could think of things that are more worthwhile.,anxiety,1
b63673cb-b9fd-4c30-b820-30606e05de15,"i’m a pretty social person and i love entertaining but so help me god i am exhausted with people who “pop by” or an hr before they arrive decide to tell me they’re bringing people i barely know with them. as someone with anxiety i have a serious checklist of things that have to be ticked before i’m comfortable having people visiting and having no time to do that, or having to cram in my cleaning regimen etc into a quarter of the time i need is just too damn much to regularly deal with, especially when people know good and goddamn well i don’t operate like that. am i the only one who hates this? i’m literally rage cleaning as i’ve now got an hr and a half to make the place spotless to my standards before people drop by. would it be too extreme to just burn the whole damn place to the ground to avoid this? haha hope everyone reading this is having a relatively anxiety free day!",anxiety,1
2a7b8764-3d26-462b-8596-79d88bf620a3,"when i’ve had alcohol, even maybe just 1/2 drinks, i feel relaxed, i can hold easy conversation without overly deliberating over what i’m going to say, i can crack jokes that i’d be otherwise too scared to make, i can hold eye contact, i can speak freely, and i’m just generally more open and likeable. i’ve tried time and time again to accomplish this while sober but it’s never happened for me i’m not an alcoholic, and i drink less than once every fortnight, but whenever i *do* drink, i find myself wishing i could be my tipsy self all the time",anxiety,1
480bfb8e-1e0d-44a0-bae0-82bdaf464d91,today i was scolded at work and had a complete anxiety attack. managed to suck it up for my last hour there but i've been sobbing on and off for at least 5 hours,anxiety,1
