ID,title,class_name,class_id
94c66c0d-a166-4abf-8806-ea57916bd525,i am getting better!,anxiety,1
96e77af9-3b14-4ea9-a348-bd80f776e91f,i live in constant fear of losing my job and every mistake i make sends me into a panic,anxiety,1
0441c306-fdbf-4ed4-8453-88eebdffb3c5,"those of you who have anxiety about family members dying, how do you deal with it/make the thoughts go away?",anxiety,1
6bfcf828-05e0-4347-8471-ddc98f902415,"ladies, how many of you experience an increase in your anxiety shortly before your period begins?",anxiety,1
3c5ffae8-fa1d-4ad5-9368-af61dfee1d39,proud of myself for doing this.,anxiety,1
d561e0b9-570b-4185-bce4-c113a3448095,had sex sober. finally,anxiety,1
e620784a-e562-4d31-a8f9-93227a707148,the most important thing you need to remember when your anxiety sets in,anxiety,1
0631cd07-0e48-475c-b8bc-bd8e480b3058,"does anyone else have this thing where if strangers laugh near you, they must be laughing at you?",anxiety,1
3916a92e-c73d-46a8-a13f-b9fa9d49a92d,every morning i come on here to help others,anxiety,1
620386e7-42e4-44a7-a9e6-3111907a6f79,anyone else freak out over the smallest pain or symptom in your body?,anxiety,1
bcae0763-5312-4b2d-8c9b-8a83b798f704,it will pass,anxiety,1
e2bee93b-ecd8-4177-9ad8-19559e32aa0f,a total stranger gave a shit about me,anxiety,1
3f801263-6cef-46af-97e7-1cc7db34ad84,cant stop worrying that this virus is actually the start of the end of the world.,anxiety,1
e0436cd9-f6c1-40ef-869e-36ac4bea03ab,anyone else suddenly have lots of death anxiety and intrusive thoughts related to death during this crisis?,anxiety,1
d714e8c3-d56f-44e5-bbd2-4b2f696d718f,i’ve got two job interviews tomorrow.,anxiety,1
79835484-0429-4133-957d-178df9dd96ab,"i just want to say, i'm really glad i found this sub",anxiety,1
1ca7885f-0865-4c58-a8b7-3b59c33bc1bb,i got rid of (health) anxiety 3 years ago after suffering for 10 years. here are my personal experiences,anxiety,1
baf7f139-fe0d-4a69-8914-e33fc34b0725,overactive mind/anxiety advice?,anxiety,1
1fb15c31-855b-4f0e-a308-e278d257a825,i’m gonna fucking change right now,anxiety,1
49b2ebd0-a38f-4494-bbbd-60bb9e5bcc2c,"how is diet, magnesium, and vitamins deficiency not talked about enough when it comes to managing anxiety?",anxiety,1
5cda062a-a1dc-447f-a15f-994b81a6cc10,a girl i know wrote this beautiful poem about anxiety and it got published,anxiety,1
11d45c92-24f3-4d63-beb5-9cbc40ef4319,anxiety about getting a job.,anxiety,1
4e4aa162-e865-4d14-9d66-09571fd77a0f,anyone else afraid to parallel park?,anxiety,1
c14664d7-5468-4930-afec-992b8c7de203,"i couldn't leave the house during my teens... instead i sat up all night teaching myself to draw, then at 22 i got on a plane alone to work abroad. (my unexpected success story).",anxiety,1
a3e66d42-6ad2-4b7b-866e-9eebca71b2bd,time is my worst enemy 😢,anxiety,1
30fd7019-2c6f-44e8-a9a9-44f24c980767,"whenever i admit to someone that i have an anxiety disorder, they say ""oh i have anxiety too!""",anxiety,1
5151e3c3-75eb-4fd9-915f-0b40a66e43e3,"i know how weird this is, but does anyone else get really anxious if the lighting ""feels"" wrong?",anxiety,1
987c6bc1-1804-4c6c-aac4-a91159728222,"i don't necessarily wish i were ""happy"". i just wish i weren't so irritated with everything and everyone.",anxiety,1
0e77d27e-bd3f-40e8-b708-83ec7c334b50,how do i learn to live in the moment?,anxiety,1
b898deda-4e0d-4454-a36e-79bcc8ee27ff,anyone ever get paranoid and cringe over your actions and others’ reactions from your past?,anxiety,1
8a35cce2-22aa-4715-986c-6b29843af4e0,first anxiety attack in front of boyfriend,anxiety,1
b172c95a-db3f-4cb9-9064-36b7e333e2d7,i can barely type a reddit post,anxiety,1
d5aae547-236e-4958-8a1b-030334bca163,'i have an anxiety disorder' is a perfectly valid reason to be anxious.,anxiety,1
3d60d7c5-4edc-4932-ad1b-e8fa0299a22a,"i just wanted to share how emotional i feel when you guys post your wins, as little as you think they might be",anxiety,1
8d4d1d61-8e11-442c-a41e-86336005693e,go get an hour long massage this week. you deserve it.,anxiety,1
970231ed-4529-4f0c-acfd-2287a2b4ab85,i'm quitting my job,anxiety,1
e22ee75c-1294-46ad-8492-bd2261a82b11,panic attack today,anxiety,1
2f55fe7c-99c0-4a8a-bdda-ab2ab75b55bf,does anyone else deal with constant morning depression?,anxiety,1
0fc189ff-99ce-45af-add8-32d976087b29,i did it!,anxiety,1
e4b20da7-5aff-460b-b199-7f2ccd698c79,does anyone else have a love/hate relationship with summer?,anxiety,1
0398c59d-e8f4-4597-8d59-08b905c9f931,on my way to the er,anxiety,1
baaef464-af14-4fab-b247-c848bf050f76,"screw you anxiety, i finally got my first job! [21f]",anxiety,1
3f76c41a-8eec-402a-be33-c2fe203fc02f,does anyone here feel constantly ashamed of themselves for no apparent reason?,anxiety,1
fc60a03e-6d46-449b-b9b1-e3dede9deed1,having to defend everything you do in your head,anxiety,1
a1362304-ff8a-42a7-b9ad-a8b9c6ebceff,i'm stressed if i work full time but if i have a lot of free time i have anxiety,anxiety,1
927ebc60-ad0a-42ea-baf8-61edf824aa3d,anybody else enjoy the rain to calm them down?,anxiety,1
9f50ea59-49f6-4055-aca5-c9f20fe5b18c,i think it's time to admit i have an anxiety disorder.,anxiety,1
e3b29973-d00c-4f76-81fc-2ef525e7110a,did any of you try running and exercising regularly?,anxiety,1
f94891b1-c58c-4842-96ea-f4ec9a9deb15,my anxiety makes me cry too much,anxiety,1
f1022eea-4885-4511-8b54-aae4a278b4d7,"does anyone else have a ""sick"" feeling in their body while being anxious or nervous, and feel as if there is so much energy bottled up in their body but feel tired at the same time?",anxiety,1
ddfe2ee8-998d-497e-bcaa-6d1012752ef5,panic attacks are back :(,anxiety,1
c253e29c-2676-4309-bb9c-31d9cc0856f4,is anyone else's social anxiety exponentially worse when they have to speak on a phone?,anxiety,1
e8f337d7-ceb4-4889-98bc-f908e2de1ace,i feel constantly embarrassed,anxiety,1
f6292df2-29df-4d06-9a35-f3f1489bf7a9,going out everyday = anxiety?,anxiety,1
3e6c03cf-751e-4164-a7a1-970abaa31519,does anyone else feel anxiety when they cant fall asleep?,anxiety,1
e0a67e50-9f9c-415c-9cc6-a698ec10fefc,does anyone else get extreme anxiety when faced with making the smallest decision?,anxiety,1
9be99593-a521-486c-89bb-d2cb09a6fbba,does anyone else feel so frustrated with the world that you wouldn't mind if it ended?,anxiety,1
5bf7a9d1-ccf9-4d61-b8b0-b21c441f4dac,my birthday was 55 minutes ago and almost no one talked to me and it's going to be a horrible year - again.,anxiety,1
251678d1-f72c-4aae-a260-d1c54923484d,how do i not cry at work lol,anxiety,1
f9dd1fd9-3adc-4ffe-a698-a620bfc58475,"shout out to those who help instead of judge. also, there is hope of successful relationships.",anxiety,1
3f6028e4-83d6-4bb1-96d6-787d8c8baa13,just had a revelation in the shower: i'm not getting better because i'm not helping myself,anxiety,1
7bc07251-8361-403e-a044-177d81f74ea4,is anyone constantly ruminating on past and recent conversations and social interactions?,anxiety,1
b63673cb-b9fd-4c30-b820-30606e05de15,people who “pop by” unannounced are the devil. full stop. haha,anxiety,1
2a7b8764-3d26-462b-8596-79d88bf620a3,it feels like i become “myself” when i’ve had alcohol,anxiety,1
480bfb8e-1e0d-44a0-bae0-82bdaf464d91,dae become inconsolable after being scolded/yelled at?,anxiety,1
eadd8326-71c0-4536-9114-c532cafdfa26,tips that i have learnt to help me through anxiety and decrease my anxiety significantly,anxiety,1
daf0ede6-af30-424b-b450-1daeaadd48a3,dae trigger anxiety simply because your brain was like hey remember you have anxiety?,anxiety,1
4d9c9291-3743-4b09-a2a5-ad944d78c5df,here to help,anxiety,1
2b692473-d870-4081-8c98-990393bc70db,we should talk more in public and to our friends and family about our mental health issues.,anxiety,1
f65416d1-49aa-4bdd-b7e2-bbd99ba63bbb,toughed out 2 major panic attacks at the dentist today...,anxiety,1
9a62c27b-1729-4836-9f48-1cc062343759,does anyone else get nausea and vomiting with anxiety?,anxiety,1
22d7698f-1468-42f2-9b8e-c304d1533e9f,weighted blankets?,anxiety,1
88fbf538-0576-403e-84cc-7a5b89dcb9ca,5 things i'm proud of this semester,anxiety,1
98c66004-a149-4816-b296-4b1274921fee,my own tips to relieve stomachaches caused by anxiety,anxiety,1
c2e5d320-bb35-479d-b370-19ac905679ca,"i got a job /r/anxiety! real, gainful employment!",anxiety,1
024a42b2-226a-4642-b4df-41434122db9f,i walked to the gas station for the first time by myself and bought a drink,anxiety,1
2f50e59e-babe-4af4-a3f1-b6e24f3bd72b,"recently started a new job: some days i feel very confident i will succeed here, but other days i think i'm going to fail miserably.",anxiety,1
753965e1-a64f-48da-a799-a6917830a54d,i was brave enough today to ask my boss to leave!,anxiety,1
d08cef52-7225-4bee-b07e-173af4b4558f,my therapist says i need to date...who would date someone on ss disability?,anxiety,1
5265000d-24d4-409e-9cfc-a0b7bfb4ebe3,after 6 months of struggling to get a job i’ve finally done it!!,anxiety,1
f039d696-3af9-41f4-8c62-c1639d461f6e,holy sheeeet i just emailed all my soon-to-be professors about my situation and i'm having anxiety attacks over it but i also overcame it and sent them after waiting for weeks to do it!,anxiety,1
80f901d5-615d-40b5-82c2-15e8a0f1a61b,"do you ever find yourself talking out loud to yourself while you're flinching, thinking about something shameful from your past?",anxiety,1
0680938f-619a-415e-b51a-ee67f2641527,gonna take a mental day off tomorrow for the first time in two years,anxiety,1
89ff26fb-1615-41f3-9f7d-dde3c968f206,"do you ever get nervous doing things you've done hundreds, even thousands of times and feel like you don't know what you're doing?",anxiety,1
fbb82ee6-97ce-4afa-8424-deaa620003cb,i want to delete my social media accounts,anxiety,1
d0e1fa0a-2b3b-490d-95f5-47c1620a2680,"does anyone else have immense tension in their neck, back, and or shoulders from their anxiety?",anxiety,1
4cef77ec-4d4a-415c-96db-0ed0460de955,important things i learned in my recovery from anxiety,anxiety,1
9fd82bbd-16d4-4dc9-ba3a-7a4f4d2741cd,"you may have heard it 1000 times, but let it be 1001th just in case you forgot: the more you keep avoiding something you fear, the more scared you become of it. and vice versa:",anxiety,1
29203862-38fd-4498-ada2-4a322b423d6b,"dae is afraid of classes, work, or places you know you ""should stay""? do anyone else feel anxious during class, skip them, etc? i need help.",anxiety,1
2b224135-ec8f-41b6-aed8-f202774648d4,"last night, i think i accidentally took a 2nd ssri pill for the day, and it was a really disturbing experience",anxiety,1
04639e40-9b58-4afd-9368-9725ec158a7d,does anyone else feel disassociated / out of it after a movie?,anxiety,1
3c5fd0f6-2c15-4382-99ce-e568ae98fc22,does anyone have real issues judging when others are irritated at them?,anxiety,1
cba2baac-df18-47ce-bc30-81bf185fd491,i got fired.,anxiety,1
3218e463-b9da-417e-b652-56ad0a2a0e64,dae feel anxiety affects their memory?,anxiety,1
b1cca103-9fbb-4e27-965f-8b4a73eeaa0f,a little tip that helped me a lot,anxiety,1
4186d122-727b-4530-9237-1d4cac074c08,dae find themselves becoming easily angered due to anxiety?,anxiety,1
d3181faf-99db-4186-9cdc-74cf208c4ce2,my therapist said the nicest thing about my anxiety,anxiety,1
5f893dbe-88ff-4ce1-b85c-1908977c2910,does anyone else get anxiety from random phone calls?,anxiety,1
63be783d-e1e3-4ba4-ade7-6b007e0a6e13,ever tanked a job because you couldn't cope with the anxiety it gave you?,anxiety,1
474891d5-b469-4dc6-abba-7847eb527092,does anyone else feel like they're constantly doing something wrong but nobody's telling them what it is?,anxiety,1
534863c1-d7d8-4500-920a-786482b4aa83,i feel like my friends aren't actually my friends.,anxiety,1
92d37ded-d33e-4d9f-8bdf-63615b6327b9,when i feel socially anxious i act overly nice as a way of covering it up and feel very embarrased and as though people think i'm fake after...anyone else have this?,anxiety,1
4cd35dbd-f1ec-4bd6-8d28-812086f32488,does anyone else have days where you find it impossible to get out of bed?,anxiety,1
1dbee5fd-4e9e-42d5-9740-fd361cf8dd25,does anyone else's face become extremely warm and turn red when talking with people?,anxiety,1
3367e412-b8e0-4c5c-8fe8-b9192776959f,what helped me.,anxiety,1
6757274c-edc3-4343-83e2-9c2186cb84e0,thought i’d share something that has really reduced my overall anxiety,anxiety,1
9bbb7375-6537-4567-9d44-bdec75d5f6cf,does anxiety lead to procrastination (of even small 'non-scary' things) for anyone else? or is it unrelated and i'm trying to find an excuse?,anxiety,1
a66f98fa-9c0c-4851-b986-24a81e4c069a,finally. after 10 years of severe depression &amp; anxiety i made an appointment. first therapy session is tomorrow. heeeelp.,anxiety,1
d7a3be0f-db4c-476d-9750-c4696a112f32,a friendly reminder,anxiety,1
b65b6ea6-76d2-48e2-960f-ebe561a66049,is it normal to have fun while drinking then feel depressed and over-analyse everything you did when you sober up?,anxiety,1
a2cc0088-a4fe-45f2-a025-59e917233045,90 days.,anxiety,1
ed68cb88-5cdd-48bb-a5f7-388408bf9156,dae constantly think their friends hate them?,anxiety,1
4008a300-4369-4cfa-9e0c-d88ef85c109d,does anyone else destroy their cuticles due to anxiety?,anxiety,1
694c5789-d5ff-4f90-bce1-108e219789d8,he made me feel ashamed tonight,anxiety,1
74ee6d9e-7855-40a0-8ffa-2d61eee31049,so i failed at life again,anxiety,1
e4a65c72-c7b8-4d6a-b5d2-c2e6c1c731f0,does anyone else wake up with an intense feeling of anxiety?,anxiety,1
bae5f41f-5120-42a9-8910-613b60a50220,i'm really struggling to make friends.,anxiety,1
326a4d37-1427-4921-a91c-4666b2c073d7,rage at everything when i’m having an anxiety attack,anxiety,1
7e3c12bf-8a52-4dc3-b236-c38ac227361c,one of the most frustrating things about having an anxiety disorder is,anxiety,1
66f2f52c-460a-40f4-a3e0-fe4a0a1ae409,does anyone else feel cringe trying to have a normal conversation?,anxiety,1
5b714bfd-fcf3-4811-bfaa-1dfd8354abf6,my teacher perfectly described my social anxiety without even realizing it,anxiety,1
978f692d-6b4e-4c09-9236-62c5609267c6,thanks to everyone here for being brave enough to share their stories,anxiety,1
6809866c-0087-4929-8da2-7c3ce0645cf9,i am developing a sub that will collect inspiring stories about recovery from mental illness,anxiety,1
62705d7d-4e50-4c9f-b429-36774470bc0f,does anyone else have panic attacks trigger from feeling good?,anxiety,1
e278e2e3-4fe7-4515-8e6a-1dcea2e0f307,"deleted all social media, except reddit",anxiety,1
38560a95-c9a2-48f7-950e-bb168c28c2c8,an open letter to the overthinker,anxiety,1
96c62191-642c-40dd-8958-a64a5fe1b472,random bursts of euphoria,anxiety,1
457d7b0d-067c-4249-8ab4-4208e791d176,i just witnessed someone dying.,anxiety,1
b68a26ff-a5d3-447b-89ec-1223a70db495,does anyone else keep thinking about and over-analyzing humiliating events from 10+ years ago?,anxiety,1
efff90b4-57f4-4b52-973b-6d836a0ad9f1,fear of bothering people,anxiety,1
cb7acdc7-834a-4590-83e1-f3a88e7d3750,i’m near an active shooting. please make me feel better,anxiety,1
4baa3193-1bdc-419b-a56b-56510198ce4a,i am afraid coronavirus restrictions will last forever,anxiety,1
17ab995c-0b62-46d4-b1ef-dfd612994c02,what is it about the power of human touch?,anxiety,1
e3ad11e5-d103-48ba-bb42-72ff8408059c,i called mcdonalds about my application.,anxiety,1
7bd1923c-2d8b-4cb9-956b-6dc777e826a8,haha screw you anxiety,anxiety,1
d22c8cff-e966-4042-8f62-e75ea3ca32df,i just gave my number to a girl!,anxiety,1
961d40d8-1038-43cc-8fa5-9b9ceae1ea11,anxiety and gut issues (let's do some supportive ranting!),anxiety,1
4a40985e-4b7a-4cff-a893-df2e8fa739f9,anxiety is,anxiety,1
0912fb13-ce33-4795-87bc-c9142a125179,laying in bed and dreading the day,anxiety,1
3bbfdf4d-8af0-49f6-aa0e-c17f8e9feb2d,does anyone else miss their old selves? before anxiety and depression messed you up?,anxiety,1
a217c734-6ac3-420e-8d40-5588322d142e,haven't had a benzo in a week!,anxiety,1
81eedf8d-54c4-497f-bde0-9e72bf784a4e,fear of backlash posting or commenting on anything,anxiety,1
be957c5c-328d-4b21-95de-2acda1105860,"you are loved, i am here for you",anxiety,1
3be9f49a-6220-4614-9a51-eccf49342288,having a hard day,anxiety,1
dfb5433f-2cb0-45da-bb21-4fe762a24f6d,anyone else tired of having to “push yourself” to do everything?,anxiety,1
f8338743-6f98-46e9-952e-0250192c6209,"i wish i knew what i was anxious about, but i don’t.",anxiety,1
9b863258-296b-4437-a3b8-617015624fef,i went through an intensive outpatient anxiety program for 5 weeks. this is the gist of what they taught/implemented.,anxiety,1
68f05148-efcf-4d12-9f27-272a3d29f074,"i did it, r/anxiety! i went to the movie theater by myself!",anxiety,1
8d07b736-b29e-47e1-9816-2fcce35846b3,does anyone here suffer from 'noise anxiety'?,anxiety,1
b154b91b-c045-40e2-a9e6-54bca3af2d08,anyone else feel fake when trying to think positive and supportive instead of critical and self-loathing?,anxiety,1
2425bcdd-6072-4796-83d7-b2d3e45e230c,sometimes i put headphones on so that no one will talk to me.,anxiety,1
68852526-f339-4b13-94b3-db180d75cf62,i did it. i said no.,anxiety,1
a418134e-1b08-4d00-b5c6-bf7ce2b38f93,my boyfriend broke up with me,anxiety,1
8c34e055-2959-4b02-9000-d3b5417fe31d,"hi, i'm extremely lonely, so i stream to twitch.",anxiety,1
da51edcc-632e-4185-b998-0f8c4d173701,did your parents contribute to your anxiety?,anxiety,1
e351fac8-7562-4ea2-a790-828625b370fd,anyone else gets anxious when people ignore you or won't talk?,anxiety,1
e332640b-2695-4448-8265-88fcedc77a67,anxious professor here: i know finals are coming up. i wanted you to know that it probably won’t be as bad as you are imagining it will be.,anxiety,1
49e4f39a-46a2-47cd-b848-ab5fd3ab8cf8,has anyone’s anxiety manifested into physical symptoms?,anxiety,1
2afb8ce3-2871-474a-820c-014b5a4b085a,"""just call""",anxiety,1
f0545fec-0a65-4ab7-bb48-51110ec6b285,shout out to all the people that feel like they aren't entitled to their anxiety,anxiety,1
ca781bb1-3c96-4fc4-8da8-8de32a2c5ddc,"read this, please, it's for you",anxiety,1
ed8d429c-755b-4f1e-b3d1-9606b8597c19,anyone ever feel like they’re not bad enough to get help?,anxiety,1
fb5c5e0b-a520-4863-abfd-7c5103e88faa,after 3-4 years i finally got a job and it's one of the worst ones for my anxiety.,anxiety,1
d4ffdb0a-30e7-4b72-a301-1f4278d57a84,"fuck anxiety. seriously, fuck it.",anxiety,1
89458624-fa75-4f21-97ad-11ff0510c23c,do you ever feel like something is wrong?,anxiety,1
aae9e494-0bd2-4742-998b-d3d725e990b2,"ongoing anxiety, stress and depression",anxiety,1
579253bf-2102-42e9-bf53-da6a98736bf8,i had a good day today :),anxiety,1
8d562bd8-4070-4a6f-af88-c22b64e7c7f1,does anyone else still stress out and feel embarrassed over things that happened 10-20 years ago?,anxiety,1
1f88c2b7-569c-4641-a865-66998bda3c1c,my #1 biggest fear is death. losing my consciousness.,anxiety,1
cfa5b017-5dc8-4c50-b660-c991c7dc501d,drove on freeway!,anxiety,1
78092a68-df7f-4b54-b1b9-da003f2ea394,does anyone else wonder what non-anxious people think about?,anxiety,1
c127092e-9910-4970-9ba9-242d398a25bf,"does anyone else get anxious when they sleep in late on the weekend, even if you have nothing to do?",anxiety,1
a95a0613-b42b-4b3c-8486-23463b34fcff,one thing to remember today if you feel down,anxiety,1
5cc1eb2b-4922-4967-91f8-ec5e5a7f6233,tips for those with frequent panic attacks or and so's of people that have them.,anxiety,1
492deb3c-b978-40b7-b7ff-b50d8ed08c7c,a few tips from a veteran,anxiety,1
42eb4daa-27e3-42a4-b16d-61a56a10770c,"i need to know if other people just have days where everything is fine, and then for no real reason, you start feeling anxiety again.",anxiety,1
5acb6a12-e375-41f6-bd69-6cabcf6c75f9,"does anyone else ever want to disappear? from friends lives, family members lives, etc",anxiety,1
6ae451be-0833-4b38-b960-fd7bffaeabd2,feeling guilty and weak after taking a sick day due to anxiety,anxiety,1
543d2682-65ab-4553-bb9b-9787759d0365,"i obsess over if i ever upset someone, and it's keeping me from enjoying talking to people.",anxiety,1
b8c4a73b-587f-4788-916b-c6cb60a68388,seeing a doctor today,anxiety,1
b27a8f04-93d5-46dc-96e7-f18721e10320,sometimes it feels like everything is too much. i don't want to die but i don't want to continue living the way i am. i just wish i could rewind or open from another saved slot.,anxiety,1
8c9fc3ec-d843-4f3d-831e-cd2bb0c6b947,perfect description of what living with high functioning anxiety is like. [link in text],anxiety,1
0326c2ff-750d-4ecf-a1e0-ffb5f618ca3e,something silly that helps me take my meds,anxiety,1
1f6530fb-1221-4817-be96-34c1ee5fdc0e,i never know what to say in response to so many things,anxiety,1
931c3656-8551-4edd-a409-bec2f2ce5683,anyone else never talk about their problems to anyone because of anxiety?,anxiety,1
d15fb7df-c464-4015-875f-ec62ab335cc3,"if you have job/social anxiety, work at subway",anxiety,1
4c3beea6-09a1-42e4-b669-26e26d4a17d7,i finished my 10 hour road trip with no panic attacks!,anxiety,1
e0d03a6b-1a37-418e-ab44-ab18253f874e,"does anyone else occassionally get hit with this crippling, overwhelming, and sheer fear about death?",anxiety,1
f79643b9-f519-4bcd-8464-66bd12d63431,called the police to help someone,anxiety,1
c42f40ff-7044-42ed-af9f-f920eb70328f,bad chest pain and stomach issues due to anxiety,anxiety,1
08c0c90a-500d-4775-8132-fc3e3bfe3603,making dumb mistakes at work makes me want to hide under a rock,anxiety,1
0f0ac5c8-fb23-4ef5-aa8f-387bb46e9c82,i deleted my social media apps,anxiety,1
f035a080-6759-444c-86c5-6f1a05819097,"does anyone ever get bursts of energy, but then feel lethargic and tired right after?",anxiety,1
bdf528cb-6ef8-4f71-b311-f3d1f2ad36da,update: two weeks with no panic attacks!!!,anxiety,1
7dbb0519-e8d1-4de0-828e-e2cb61d6cf02,i have separation anxiety.,anxiety,1
5537a7d2-d648-4cd1-845a-e470b757e6f5,can't open up without crying.,anxiety,1
5042a857-6bc5-4994-9d13-71864ce2ec8d,"a friendly reminder - you are not alone, someone loves you enough to value your life.",anxiety,1
8cdd9070-4d35-45fc-961f-9fd356b11e21,anyone else wish they could have a day free of anxiety?,anxiety,1
af2d0bc0-ffae-4826-9e9c-214bcc8b3c70,i just want to thank everyone who suggested magnesium,anxiety,1
83456451-1f88-40eb-be0b-5fd8dfa82a1b,03:44,anxiety,1
c35fc4c4-a677-420a-8e7e-6068f458e1ae,"today, i am kicking anxieties ass",anxiety,1
32ce0fd7-a0d5-487f-bd8a-b87d43574274,"i feel like there is something fundamentally wrong with me and i can only talk about really deep, broad topics.",anxiety,1
35cfac9c-0c4e-49a8-909a-1f54e299aa95,way less anxiety after quitting caffeine.,anxiety,1
f71af452-5840-4c14-919b-359ae9315117,"haven't gone out of my small apartment for 3 days, but tonight i managed to go for a run.",anxiety,1
a2ba4994-997a-4816-920f-230b400976f3,"i didn't get the job, but i'm proud of myself for trying",anxiety,1
34456257-44a3-4714-bf94-dfb75251ad5d,does anyone else over-analyze every interaction they have?,anxiety,1
5dce3f84-15c1-4a0f-bcd6-ae8778be255a,"i almost didn't go to the interview because i was panicking, but i got the job!",anxiety,1
1843a046-6a30-4b2b-aa2b-20e4e4fd99e8,i took my driving test today and passed!,anxiety,1
b7253171-c038-489e-bc75-2fcd18ad330a,getting out of bed is really hard for me. is anyone else's anxiety worst in the morning?,anxiety,1
13889e40-f402-44c5-8391-975a2196798d,am i the only one,anxiety,1
d467dd6d-7202-4f95-8c29-e0fd4dae2f35,does school make anyone else feel hopeless and lost?,anxiety,1
1f7d8859-169e-4452-b0c8-a89d0ddd1af9,"29 years old, no friends, no girlfriend, virgin, hermit. anxiety and depression has ruined and is ruining my life. please don't become me.",anxiety,1
efa5861e-28f5-4e69-a7ac-f84e860b1f11,"anyone else sometimes have these moments of clarity when they realize they're not feeling that anxious, and the realization itself makes your anxiety come back?",anxiety,1
3dd9e741-7666-490c-ab48-269646b21965,i'm finding it so hard to do anything at all,anxiety,1
092c99a7-bcab-4b1e-a85d-954f143d874f,started on lexapro last night—hoping for the best!,anxiety,1
9d81b7ed-64c9-4320-a15a-8f3512da05d7,"i’m sorry for the long post, but i wanted to share my tips for how i manage my anxiety.",anxiety,1
34d7341e-0aa9-4b19-a068-7dc0f964360b,tomorrow morning i start my next semester of college after taking a year off for my anxiety,anxiety,1
94697042-9f17-4ceb-9bc4-382610bfbbd4,i took prescribed beta-blockers today.,anxiety,1
f619d026-544a-444d-84c4-cbef97eb32cf,so much of my childhood was undiagnosed anxiety,anxiety,1
f50cea44-ced2-48ac-a831-e10927584cd2,anyone else talk/vent to their pets to help with anxiety?,anxiety,1
6bf5215a-b2e4-4a57-b619-1f20823c2aad,why is self hate a meme now,anxiety,1
eafad130-ed3b-4fe7-a9ef-99ae170d7043,does anyone else hate when people say “always follow your gut”? if i did that i wouldn’t go anywhere in life...,anxiety,1
97e511ca-ae85-4393-99da-9eba9d95334c,i need your help. i'm a step away from a suicide. am i the one that is wrong or all the people around me are just plain stupid?,anxiety,1
401d8024-b059-4a9f-9e5b-98b162868a44,anxiety &gt;&gt; anger,anxiety,1
64a92802-8a42-4ed4-b810-b4358c3829d8,a different kind of lonely,anxiety,1
ef45c031-3699-4d45-adb1-8e59513059f2,i went to a bookstore and got a coffee by myself today!,anxiety,1
633edf40-1c4f-4a1b-a4b7-bf9830e823fc,its literally crushing,anxiety,1
461d66bd-5c12-4af0-aec9-59f7912a0e38,how do i break away from victim mentality?,anxiety,1
aef522ef-f98f-433f-b17a-fb62f1b37b4c,sunday anxiety,anxiety,1
cd8d2e37-8e4e-4c7a-88e8-88cccd6d6f70,stupid obvious but needed public service message,anxiety,1
6c754d27-433e-4dcb-948d-cadb7564cd9e,i just asked a girl out for pretty much the first time ever...,anxiety,1
