ID,title,class_name,class_id
d4295391-9ca5-4398-b7c8-687e4a984ef1,the epitome of my life,adhd,0
649a668a-4159-49cc-9db7-f4d172040d08,"how many of you found this sub just by saying ""hey, i wonder if that exists"" and manually typing it in?",adhd,0
0b5bb230-afdf-40c0-9f03-e35aa473a46b,if counted how much walking i do while pacing around trying to find my phone my step count would be amazing.,adhd,0
289150ec-1ebd-44e0-9211-91feb57ef122,how have you improved your social skills?,adhd,0
7a94c538-d2e9-40a5-8595-72a8695263ed,my husband has been ill and is flabbergasted that he's now doing things that have always been everyday adhd symptoms for me.,adhd,0
d6baf229-9e9b-4ef6-874a-42bba4dcd2e5,"i've spent so much of my life trying to force myself to do things, that i can't tell when i'm actually sick and exhausted.",adhd,0
36522d33-91f0-4aa7-ac47-ee1049bc916f,sleep is the number one thing (and why adhd has a sick sense of humor),adhd,0
8e6fdd2d-bf9d-47b2-ba8f-62eafc5e8aaf,my son started vyvanse this morning and the difference in him is mind boggling,adhd,0
0399c24f-f891-4ef9-adc1-8cac4aad0c75,it's funny how we talk too much but also get bored of hearing what others have to say.,adhd,0
2a763e3f-e93f-4702-b36f-0751a8b56e5a,i feel like adhd traits make me a terrible human being,adhd,0
0d29d7b2-814d-4331-b054-d011a5e42b34,"after 30+ years of trying to fall asleep at night, i've finally solved it. i could scream of relief.",adhd,0
9bb70053-9d0f-49b0-9c2a-940ae812b0a7,why baking carrot muffins takes all morning,adhd,0
b962ec8e-d92d-496e-985a-141b9784b8d3,"intelligent, introverted, underachieving women with adhd undiagnosed until adulthood: i have questions for you!",adhd,0
a9867565-9123-422f-ad78-db749482e2e3,my husband is married to a child.,adhd,0
8c0b3da0-08b3-47e2-b6e7-c8aff952b338,it happened. i lost my job.,adhd,0
be1ea12b-b532-474d-afe4-2b5686667bec,nobody ever told me about the emotional side of adhd,adhd,0
532ccd35-cddc-4e43-8913-38d2d8491143,today’s adhd tax: missed a hair appointment because i was playing a computer game. i’m 39.,adhd,0
14dc9d66-4bfd-4a41-9fd7-e607cf1ecea7,anyone struggling with word retrieval during conversations?,adhd,0
856e4a53-7576-4e94-a2b7-99926ab76190,"i have to watch videos at 1.5x their normal speed because i am completely unable to focus, learn, and retain anything from them at normal speed (and other auditory processing issues).",adhd,0
ab69dbf7-db78-480d-ab7f-ec48ffeb1350,video games,adhd,0
c3f36a9e-354a-4e65-9ba3-c80f03820d22,modafinil: what was your experience with it?,adhd,0
0db5bc85-982d-4ab5-9efc-86bd4695c680,"having adhd is buying help books to try and use, but then completely forgetting about them and when you do remember them, you have no attention span to read them.",adhd,0
e81a140f-8621-4628-803c-58beb80c2ed1,"adhd shower thought: when mind/thought reading technology combines with digital assistance (ex. siri, hire someone to design my new idea), adhders will be the most productive people on the planet. particularly during those hours between going to bed and actually sleeping.",adhd,0
4a057222-cf39-4369-b399-ec50300c595b,"today i realized my pharmacy gave me the wrong dosage for my adhd medication, and this is a reminder for y'all to always always always check your meds!!!",adhd,0
ffbe4c08-8697-42e6-8a5e-75b97a41b1d5,"“i can’t keep skipping class”, i say as i continue to skip class",adhd,0
449ec5c3-9959-44d3-9865-2ca73b185f14,is there a reason why i also delay the things that i genuinely want to do?,adhd,0
797a57f1-8040-48ad-b797-3144bdf69574,i did it...... feeling proud of myself!,adhd,0
097c4cac-d4b9-4a44-b5f2-bf31ddb8e5d6,who knew it was so easy to cure adhd all along?!,adhd,0
21140c33-7443-42b7-9461-b74bf3fcff6c,what it feels like to have adhd,adhd,0
46468abd-f802-436e-a0f3-eaaa4bb6ca81,"inability to regulate anything in life, feel like a loser",adhd,0
3f23d8ab-17ec-4dfc-b497-3279d7e9ab43,just took a nice dive in the dumpster!,adhd,0
d8a21d16-31b3-4bd4-820b-441bfefeca7c,tired of seeing so much advice to parents when looking up things about adhd for myself.,adhd,0
82f31de8-6563-43e1-a2b7-7e1bfc1b3109,holy fuck i graduated. i'm finally finished,adhd,0
f5f6e43d-1a72-4cee-8d23-8350af44e3ce,"looked for books on adhd and how to cope with it, they are all 300-400 pages long. bruh, i stopped 3 times through the title.",adhd,0
c0219da9-58fd-4853-8a6b-2cff43eb4e96,how does one not get bored of other people?,adhd,0
049a9296-4acc-4e96-98cd-ccd95929fe31,what's with the lack of urgency?,adhd,0
f691d3a9-4b21-41a4-a76a-d6273de3e082,rocking chairs.,adhd,0
5ef82dda-4aed-465f-b79a-4211930b1537,things non-adhders will never understand,adhd,0
a2304a2a-b661-4ece-891e-c5855c9eec33,trying to force yourself to do something you are not interested in is essentially inflicting psychological torture to yourself.,adhd,0
a474d3f1-63bc-437a-9578-cba8a3c8ac84,"""but people without adhd also struggle with *insert thing*!""",adhd,0
03c791fe-f80e-40a1-834e-5225fc489169,do we overcomplicate everything?,adhd,0
3314d801-0930-4577-a5c7-c643b3e5e544,women with adhd - do you ever feel like people see you as a 'manic pixie dream girl'?,adhd,0
fecdb506-c45e-4688-b9c8-c27e366e4e72,my medication is paying for itself,adhd,0
fca38019-476a-41bb-a7de-2cb01e6bfecf,"if anything gives me motivation, its to succeed out of sheer spite.",adhd,0
3948cd69-5d82-4f1b-9592-59d65df557aa,one of the biggest ironies about adhd for me,adhd,0
2d495fce-0139-4818-9680-a56b651ae1d2,i've got this cycle i go through every year,adhd,0
9d40b35e-8771-4fe7-9f78-4a9e0fcb902e,sex feels like a chore that i don't want it to,adhd,0
12bcfa0e-c0ab-4427-8eb4-246bd44a251b,"i’m sorry to be a downer, but i’m tired of reading about how adhd can be/is a gift.",adhd,0
95ccf347-c593-4d81-963e-3d0947f8ecc9,"psa: despite being medicated, i advise everyone to invest in a whiteboard",adhd,0
2b22f149-cf9e-4441-8704-82ee45ff9408,holy shit the drugs work - subheading: training at altitutde,adhd,0
d03027bf-64f1-4aeb-a870-de80c4cbc3fd,"i really hate it when people say ""maybe you should think before you speak""",adhd,0
aa0df32b-c689-407f-9046-863afb3f1df4,"got sent home from work after ""looking high"" 3 days after starting vyvanse",adhd,0
456d0029-4eb9-4be1-94ce-e03d345aeb00,the tile is life changing,adhd,0
651ac20e-2814-4f51-aba0-eab9b90093a1,"i can't finish my tasks, but yesterday i spent 3 hours shelling chickpeas",adhd,0
0b0f1daa-ee88-4fac-b467-896f95942e60,[update 1] i went and saw a psychiatrist and she told me medication doesn't work for people with add,adhd,0
112d3bab-06ee-4d2c-a7ee-95ad126a9bcf,do you worry about the long term affects of adderall?,adhd,0
a79e3152-2a09-4e6a-a492-08356411ebe7,who run the world? ...girls?,adhd,0
60bfaa85-01ae-4fdd-b10c-b61c9b6cf03b,"had a facebook friend post a meme that compared meth to adderall with the caption ""for those who have friends that take adderall and swear they aren't a meth head.""",adhd,0
9c58fd99-01b8-4aca-83fc-122f72018f71,"a 2003 study that found, ""that children with adhd are more likely than children without adhd to become involved with deviant peers and, as a result, more likely to use substances""",adhd,0
be918966-00b7-4451-9a49-6f0aa47153a9,a glimpse into an adhd brain,adhd,0
29e426ea-2a92-4c9f-99bd-a24600cbc300,getting out of the adhd depression loop,adhd,0
74f3f8da-ed5d-409f-b24e-eac708a88fce,"thank you guys, with all my heart.",adhd,0
61ca8250-bf9a-4e8c-916c-e23f66bc6882,wake-up habits are everything. take however long you feel you need in the morning to face the day.,adhd,0
bcd004a6-2b4d-4334-b7b0-d1c85272d24f,successful adhders - would you like sharing with us what helped you most overcoming the adhd struggles?,adhd,0
06e7b873-9cf7-4a22-a212-56eab2a7b5a2,do you have word-finding difficulties?,adhd,0
a5738f3a-eff9-42ff-a42f-319b1e693069,"i haven't successfully read a book in 6 years. today, i've read 3 chapters.",adhd,0
b098fede-4be4-4c41-935b-d4861ff5f331,any of you guys experienced heightened hyper focus at night?,adhd,0
0212e530-c44f-4823-981b-6c6e512fe494,i love that adhd is treatable because i'm finally getting help. i hate that adhd is treatable because now i know my life's worst regrets might have been preventable.,adhd,0
8e61e957-6482-439a-91fc-5f12b5b29146,you ever think about so many things at once that you don't even know what you're thinking about?,adhd,0
6812a08d-a7b5-486d-b73f-d095bfb2331a,i am the worst storyteller,adhd,0
60faa17f-4ec4-4a1d-a407-fa079d018e7a,adhd + depression makes every day feel like a fresh new hell.,adhd,0
7dfed816-4ea3-4802-abe9-b6bc7c9f5052,"always forget to ask ppl ""how are you?"" back",adhd,0
4149fb45-9243-4f6c-a770-7fb904cedd41,do you ever just.. stop what you're doing and don't know why you stopped?,adhd,0
05ce79e6-8ab2-4ddb-925e-b5a548c265e6,"can other people just ""see time"" in a way that i/we can't?",adhd,0
f11471e5-1a96-4070-aa24-f75b1b64f536,"have you ever been very quiet/reserved/shy due to the punishment you've received for being ""all over the place"" as a child? you may not have the ""hyperactive"" personality anymore due to being conditioned to repress it, but your mind is still constantly racing all over the place?",adhd,0
dc567338-e38d-4936-abd8-aa25dd4a47cd,i love learning but i'm a terrible student,adhd,0
09a25d60-32e6-4abb-bb72-9563ffc6435d,i spent 3 hours procrastinating on a couple of tasks that literally took me 10 minutes to accomplish.,adhd,0
b26378cb-4859-45df-8ef7-cc8d27f4e784,"if you suffer from procrastination, maybe try this:",adhd,0
df74a80a-02a7-4e8f-ad97-f68f868588ee,"[rant] ""have you tried just breaking the task into small steps?"" and other well-intentioned advice",adhd,0
d5108b46-f090-4297-a1f9-49ee2fe7a55a,do you ever find yourself in a group of really smart friends but feel like you’re the dumbest one?,adhd,0
076ec95d-222c-4fdf-ace6-1040e21c19ec,i just got my dream job!!,adhd,0
17d74d9d-d864-4be9-aee3-19e8c77544ae,is getting frustrated from over hearing conversations/ loud noises a common trait ?,adhd,0
948da02e-c205-4780-9d57-efd01f285312,"white noise improves adhd concentration, it worked for me. i'll explain in thread, welcome!",adhd,0
b4b4e135-506b-4459-841d-b0903be0cde8,"does your mind ever go blank during conversations, especially difficult ones? [i-adhd]",adhd,0
2a8f86e6-95f2-4eb1-96ab-f1abce406785,i got all as for the first time this semester.,adhd,0
641373cc-24f2-4f73-be58-d09167804294,"fuck adhd, fuck rsd",adhd,0
3035d8ee-9565-424b-b228-f143ea85586f,i actually graduated.,adhd,0
d3366e34-ca10-4e87-99c0-e4fc726f4a2d,"hey you! yeah, you!",adhd,0
d04b7312-5b39-4a09-84f2-9d1263eb201f,does adhd cause you to put off a lot of tasks?,adhd,0
0f2b13b7-4ff5-4ea5-920c-7158888f6aa9,adhd to-do list hack: the power of “or”,adhd,0
c7dd2886-08ad-4115-8266-ebe1eeb09362,i have found the best way to motivate myself to get work done!,adhd,0
4c440ad2-9824-4708-a0ea-63c571c87ed2,procrastination and shame,adhd,0
28dd40c1-548c-4ed1-b077-97f658269d09,i'm addicted to (organization) porn,adhd,0
00d75f2d-c273-445b-b380-bb0d26e12ac8,"what are your guys' thoughts on ""flipping the classroom""?",adhd,0
823751dd-da85-4730-a28a-792e52cbf04a,"takes meds... approx 5 seconds later: ""did i take my meds?""",adhd,0
fd193761-6bf8-445a-9f0a-165d21751484,i have a mile-high to do list and zero motivation. :-(,adhd,0
d1f29fda-95d0-4168-8f5b-ba4a4b16416e,everything is interesting when it's not what you're supposed to be doing.,adhd,0
c6d8fffd-c74c-4b7e-b8ec-d29d168ba623,do i suck at responding to people’s messages because i have adhd or am i just rude,adhd,0
ae81ca1a-d12b-4602-a389-30e007b96a72,"i used to procrastinate then panic at the last minute and get a rush of motivation so i would get it done. nowadays i still procrastinate, but the motivation never comes. just background guilt.",adhd,0
ce782baa-0b87-4956-963f-df4bc48efce2,have you guys ever tried rock climbing? it's been incredibly helpful for managing my adhd.,adhd,0
12785f82-0547-453f-8eb2-93b1ccbd8264,"my ""every other day schedule"", or: how i stopped feeling like time constantly just ran away from me",adhd,0
e75d76ae-eaeb-4b82-83c3-f4f358711eb4,"as one of your warriors, i am proud to announce i got into medical school",adhd,0
82bedcaa-fd93-4ae6-82cd-83cb776ca712,psa please read if you are taking stimulants long term,adhd,0
8b2791c3-0ce4-48eb-92d0-14e0c8df8e00,what are your experiences with rsd (rejection sensitive dysphoria) and adhd?,adhd,0
f9b7a701-6126-4838-b2f7-98dd37a828cd,"the more i learn about what it takes to be successful in all aspects of our humanity, the more i realise how much of a disability adhd is.",adhd,0
b6c74b62-d9eb-4b00-8e2d-3a70b5aafc02,"my daughter has adhd, this sub has helped so much!",adhd,0
a08e1dc5-4993-475c-b162-89ab023b6e52,"the frustration of wanting to do things, finally having time, and completely forgetting. all of it.",adhd,0
81cbeb99-c9da-4d25-adf0-4f1484b14408,"you can't have adhd because you're not hyperactive, you weren't diagnosed in childhood, and you're in university.",adhd,0
755e0efd-34a2-4ebc-8fe8-e47e5b655c64,how to stop picking thumbs/fingers/scalp?,adhd,0
1339a802-c280-4257-9a19-cb0b11f0b4da,"""notes before and after adderall"". the ignorance is real, folks.",adhd,0
b65d08a9-533e-4a57-9041-3c8e4ae58487,fed up with having a brain that is smart but not functional,adhd,0
02530185-abb3-4d48-bed8-48a11602d60a,how often do you pull all nighters and still do no work?,adhd,0
595a82a5-b295-48fd-8ba7-e87f9f3b10a2,"i'm bored. i want to do things, but then i want to do something else and end up doing nothing.",adhd,0
ccce49e3-66d4-400c-9271-1accaac879e4,"adhd at night, random bursts of energy or focus for no reason",adhd,0
a6fb6b08-c3c7-4861-8125-21f4ba38e4a5,"ladies and gentlemen, i found the one.",adhd,0
5fa32a08-9870-420e-ac06-38fc905ec69e,my phd supervisor told me that adhd is simply poor (learned) behaviour,adhd,0
263b1636-5efa-42b5-b088-594081ec8baf,"sometimes i wish i actually was just ""lazy.""",adhd,0
c14c00d5-cd59-4517-b6c6-8ac6e38574a8,"50 years with adhd: missed opportunities, failed connections, no direction",adhd,0
9dbb8fda-a6b3-4533-89e8-9ca1f40bda9e,why your brain tricks you into doing trivial tasks (tl;dr: it conflates urgency with importance),adhd,0
ebdd132d-6104-42c9-869b-f2c3286ace4e,"i feel like i was programmed to fail at life, i have never talked about this with anyone and seriously need to air some of it out. on the brink of suicide.",adhd,0
5c08aaf1-1cb6-4bff-a7dc-c81dac970cd7,"after waiting a few days being worried about trying my vyvanse, i took my first pill. wow.",adhd,0
2599fee0-d96b-4877-8ed4-57cf612ffc0c,ordered the “mastering your adult adhd” workbook — and i have no idea where i put it,adhd,0
eb0943fb-b2d4-4b50-9b8b-adba330dcfab,"you know, sometimes i forget i already put a dependent clause at the beginning of the sentence so sometimes i get really repetitive you know",adhd,0
0236c31b-b36a-40cd-a219-6ae0b79e0591,"hey, did you know we all outgrow adhd at 18?",adhd,0
7f1cf0e4-9dad-48b3-8104-0a08b8ab225b,feeling resistance when beginning tasks?,adhd,0
c94a7738-c0b4-40ef-8864-9a86f947baef,is working out boring for you? play justdance!,adhd,0
f8463bc4-c3d0-4b9d-854e-861c4de9fae0,"it cracks me up that all of us ramble, but none of us want to read long posts.",adhd,0
17e4a711-a6a1-4f54-8103-be9b2aae5ab9,wow i did everything i wanted to do today,adhd,0
6ae7aa58-4a8c-4d4c-9aae-e919c75b0d8b,adhd protip,adhd,0
67e36b44-13a7-46cc-b13c-074338134654,40 minutes into my 1 hour commute to work...,adhd,0
66483bf2-48a6-44dc-9efc-e71a0afbe421,their are 2 phases of an adhd person doing an assignment. phase 1: cowering in fear and self doubt . phase2: the terminator.,adhd,0
4b8ba3c9-95b5-40f3-b612-843d73dd135c,having a terrible couple weeks with depression and adhd. how do you motivate yourself during a difficult period and what do you do to get back on track?,adhd,0
e50c5833-a368-432f-afa2-c773433eeb1a,forgetting that you're depressed,adhd,0
5ce6701a-3cba-4aa8-b405-cd2caf459e3d,til not everyone is like me,adhd,0
f93e04b7-df52-42f3-8771-14b54b3db900,now that nearly made me cry,adhd,0
7e411aba-62bd-42ae-b4f3-67e754410c9e,i finally feel like i understand who i am. i understand what is going on.,adhd,0
1d3e620a-407b-41ec-98b5-b1e7cdcce943,getting medicated felt like finaly reaching the other side of the fence and realize that the grass was greener all along.,adhd,0
003b6a90-47b6-41af-bfdf-e91dacc97642,an adhd meal,adhd,0
2976c879-1c46-47a8-834b-68fd79f5d2c0,"over the last couple years i've filled an entire bookshelf with books i want to read, and i haven't finished a single one.",adhd,0
a209f892-2697-44b6-ae7e-2c9aec1d6573,my heart :(,adhd,0
12074b7b-f506-449b-b358-de4be624a622,"is it logical to get annoyed at the whole ""adhd is over diagnosed thing""?",adhd,0
14c8fe57-f28b-4ff8-b13a-c5ff8a416dd8,i (23/f) shaved my head because i can't maintain my hair. is it normal to struggle with keeping up good hygiene?,adhd,0
04c56157-c99c-4791-85cc-aa4b7fba92d6,how many of you take weekend med breaks?,adhd,0
02f6e4fc-56e4-41f7-b1cb-d31901942c1c,is it common amongst adhd-ers to pick at fingers / skin?,adhd,0
aa49055c-1cc8-4442-9163-e804feeeead6,adhd fog brain hell,adhd,0
453b1231-6ba9-4923-8db7-4dda8eb3c26d,"i finished high school with a 96 average and i am so happy, but damn i worked so hard for each point",adhd,0
c021c225-6763-4367-87f0-945a3024ccf5,list impressive things that you do,adhd,0
248c7d71-e76d-4f25-bf73-7143a8d6bc74,teared up while eating my bday cake :(,adhd,0
5420ee97-cea0-4c23-be4d-f242fc82b5c6,word of caution for those with high aspirations (as in advice on how to make them come true),adhd,0
0a54bd6c-abfe-40f7-9202-899b53232c54,"how i am motivated to do things, but don't do them? riddle me this adhders.",adhd,0
910d5a7a-8b73-4c82-9843-fcb72994e087,the unfuckening of my life,adhd,0
2d836386-37ee-411e-a113-66c4a2f189d7,timer and chores: total success!,adhd,0
adfd8022-9d1b-44da-8af8-26c480d9d3ff,annoying friends and having adhd,adhd,0
d23f3c49-fd54-4744-af3c-c4b9fc456c77,my roommate has been stealing my adhd medication,adhd,0
131f7574-e72b-4805-9b40-22340330e1c4,i no longer think of myself as lazy or a master-of-none. i'm a generalist and most people are specialists.,adhd,0
09d63a65-4d6b-4759-a030-025d2194867d,a helpful video i found (and summarized here) on how to handle executive dysfunction: create a dopamine activity menu for your brain!,adhd,0
27bc3041-f042-466c-87ba-1938d3cb7be8,bored and scrolling? why don't you take a minute to look at all the saved posts you've forgotten to go back through?,adhd,0
f5abdfa2-8543-410d-b67d-50aa61777140,"that ""sinking"" feeling.",adhd,0
7b60b6ab-f6d3-4204-a0be-a80a6c37fdf8,i graduated from university!!,adhd,0
dbc66ae7-573f-4850-965a-b3b2d6f1cc42,what is your favorite _____?,adhd,0
10888d13-8e5d-4d0c-801c-bfeeba477fd3,"that feeling of not ""grasping"" a concept",adhd,0
1ebd0ddf-17c9-40ac-9032-70affb27964a,have you begun to forget words as you’ve gotten older?,adhd,0
a203d491-5a50-4a8b-8d21-da90d1f4307a,"my therapist has me email her this so she could print it out and keep as a ""classic adhd story""",adhd,0
c1121bd8-1d84-4227-9c5e-25f2d2d27304,who else thinks about how easy their life would be without adhd?,adhd,0
6b36331f-6270-447a-9814-f842ddba8c07,who else gets really bad brain fog?,adhd,0
d05107f8-7201-4fc8-ad29-2a1977f34326,"i become obsessed with an interest temporarily, then my focus changes to another interest and it makes me angry + other questions",adhd,0
69e1d046-c47e-4f9d-8d1e-59b8aa015d82,two tricks to practice meditation and mindfulness while you have add and are on adderall.,adhd,0
0c1a4b3d-1999-402b-9bcc-665dc69470dd,"my psychologist is so understanding, said this to me.",adhd,0
8512837e-8deb-43c4-867e-c4293826cb5b,you know that thing you've been putting off? that thing that will take 15 minutes but you just haven't gotten around to yet? do it. do it today. you'll feel better.,adhd,0
60f5d1d6-5982-44ac-8709-09e25377d6fc,ever feel like you're not being the person you're meant to be?,adhd,0
0e33f1b6-1a15-4dc2-8862-3e8eb96af33f,"""you're annoying""",adhd,0
61bed2c8-9f1c-4cf0-beca-2891117a2605,achieved a long term goal of mine that i was afraid i was too scatterbrained to get to!,adhd,0
8a8662f1-642e-4266-b6ea-8a9809d54366,"i want to give up, i can't make friends",adhd,0
d889c01e-6f3c-450c-865d-d792fe72b093,i read a whole book and i'm really proud of myself,adhd,0
8659fe27-8d30-494a-b979-088e92ded6cc,pro tip: don't browse this sub in the mornings,adhd,0
000febe5-8c8b-4128-8d01-42ba00cdf033,it's not a bad thing to take medication.,adhd,0
c39c9eb0-afc5-4227-87cf-6e48dc44dea6,"exercise. meditation. medication. simplification. routine. ladies and gentlemen, i see a way out for me.",adhd,0
edc5010e-6332-45e9-9fd0-c8eb2061e8fa,my adhd is so bad that the county tax collector won’t take my money!,adhd,0
562c8fdc-5b51-4b99-a184-c7402b348919,fantasy vs reality,adhd,0
de48d826-9f31-4b26-ad26-5d45c85aabd9,for those of us who struggle with guilt about not completing your plans.,adhd,0
0053f3ea-1cf9-4ad9-bfc0-a4755aa204ef,"if it's not written down, it doesn't exist.",adhd,0
f1ac98d4-6f26-415b-b4ba-0812b7922f87,post conversation paranoia,adhd,0
5c69796b-c23a-4efe-83e0-fdf9fecfec0b,adhd and depression can be two heads of the same demon,adhd,0
fc923d69-cd0a-41eb-afd8-51618b0d8da1,forgetting bodily needs.,adhd,0
80349500-b1be-430a-9692-5d3dcc8ffac9,got a diagnosis. i'm 31 years old. so much of my life makes sense now!,adhd,0
a2086b99-1c57-49d3-9c9c-81d894f9061f,word of caution for those newly diagnosed with adhd.,adhd,0
ac6c3832-1a8a-4605-9cca-d7812e537035,lpt: be 100% sure before disclosing your adhd,adhd,0
66f4d121-a400-470c-a58e-c318c8ce2246,why uncluttering is amazing when you have adhd,adhd,0
da5a8411-86da-4a74-85f6-93f1753a3fc8,"i often can't hear what people say, so i went to the doctor to test my ears",adhd,0
8ca269cc-882c-4ef9-863b-21b26645f06d,"my favorite analogy for adhd: ""you have a ferrari engine for a brain...but bicycle brakes.""",adhd,0
cb525776-cb08-4d62-a4a8-52d6f0d3ead8,avoidance and apathy,adhd,0
c4feef7a-a028-4137-a71b-5c0ddaf729fd,got into grad school!!!!!!!!,adhd,0
21b1b1ef-4ea4-4917-a826-a51e99392057,not allowed to tell a student they have adhd,adhd,0
7521dff6-a1b5-4600-aa2b-ac52a4422af9,"the shitty/funny thing about adhd is that our ""hyperactivity"" is treated with stimulants... creating a lot of annoying confusion from others.",adhd,0
f4eab1ad-68c4-4b32-bf0a-30d5754d2f41,the special hell that is being a parent with adhd with a child that has adhd.,adhd,0
a25094c9-88a7-4fa2-aaa4-30d2d0f2d7fb,something i finally realized about medication,adhd,0
9abd0496-4560-4004-83be-cfbb622f1b17,today i was blessed with his appearance.,adhd,0
aefb78c8-3036-4f63-96f9-a1052ed31a27,do you feel that your social skills are lacking as a result of having undiagnosed/unmedicated add growing up?,adhd,0
a3868ca0-c5fc-4fdc-9c72-5a2390cb3493,addiction. let's talk about it.,adhd,0
b1d6be12-443a-4381-bd98-efb120e6b695,i fucking hate filling out applications!,adhd,0
85465d69-9c0b-4023-94d6-061cc498fa72,today i lost a job i loved due to my adhd/depression and now i don't know what to do.,adhd,0
212e5273-f11b-4bf3-88ce-24b175d151a0,when people ask my 'what's your favourite ______? i can never think of an answer.,adhd,0
9b8bc8bb-3e22-4fd8-8afe-bec60598c286,internet is really bad for us adhd people.,adhd,0
233514d4-8f21-47ee-865d-590797b4860a,how do you guys deal with being told to do something that you were already planning to do but now you don't want to do it because fuck the person that told you to do something?,adhd,0
7a9b8996-c33e-413a-aa41-8ae8e073354a,constantly lying to people,adhd,0
95bbac66-d45e-4843-920f-9e9abf5e8bd2,~shout out to all the kind souls that return our lost things~,adhd,0
070ceecb-e650-471b-a659-879b3401eb8e,nature and forests feel like my home,adhd,0
b81707a7-0b97-438a-91eb-5fd86a5b35b2,"the worst part of adhd, the part that breaks me down and makes me just cry and cry and cry",adhd,0
e7395965-cab9-4d7e-8695-04c74b06961e,"i hate my adhd, but i love it at the same time.",adhd,0
f66a0a48-a1f9-4fad-ab9c-cec5a9dbb949,"it's all fallen apart. i wish there was a way i could just declare bankruptcy on life in general. i desperately need a fresh start, or something.",adhd,0
7b24a98f-8c6c-4e4e-8d2d-368884998d20,"the ""i have it too, it's not that bad"" people are worse than the ""it doesn't exist"" people imho",adhd,0
fad042d7-1f20-47c7-ad3d-3f43c268e748,who else has done this: finally finished a project you started over 10 years ago in just 1.5 hours?,adhd,0
79027617-1107-41d9-b6e7-54954f259c08,i tried to clean my desk...,adhd,0
ca9ce824-c1d7-438b-a97d-48c12e67c934,do you enjoy pretending a lot? such as pretending you're being interviewed on tv or listening to music and pretending you're the singer etc?,adhd,0
a9c2e7f5-6372-43c4-b01f-10b305a245f1,"it's as if there's a constant, near impenetrable barrier inside of my mind that prevents me from doing the things that i tell myself i ""want"" to do.",adhd,0
2ae8aa8e-c949-46ed-8c08-15a806f71c1d,"most of my life i've thought i was just depressed, yet i coudn't find an actual reason to why, i think it just dawned on me after finding this subreddit.",adhd,0
2b7ea6ce-0662-4391-b936-833cfb5e74bf,lying about what i accomplished today,adhd,0
f6cbc8a0-144c-4738-9077-f65ea3a63b85,today my adhd won and i'm okay with it.,adhd,0
f4c8ad2a-b43e-45fa-88c5-07d01f02b1eb,"having adhd is like i'm saving everything to my desktop, named ""asdfaf"" and ""aaaaaaa,"" and i can't find anything and i get too overwhelmed to clean it up. also, i actually do this with my real desktop ugh.",adhd,0
1740efac-95d4-4709-9dfb-3873913b9b82,"people often say that adhd is going ""hey look a squirrel!""",adhd,0
