ID,title,class_name,class_id
3e635f3a-2bc2-4461-8c83-1bff51ff7295,has anyone else looked at their handwriting to see the difference between a manic and a depressive episode?,bipolar,2
e69e72c2-7b9d-43a8-8463-d600fc0a9e82,"does anyone else blame ssri treatment, or another trigger, for their current state?",bipolar,2
a3cc6c1d-38f0-4b54-bc45-da1cd2360a15,that post about taking 40 minutes...,bipolar,2
8dca22b6-dbd7-4757-8ca2-3804280a04cf,today is national suicide awareness day.,bipolar,2
74e55c68-bcf7-4d6c-be2e-bdc8ae86e57c,i wrote this during a depressive episode. analogy of how i feel about my social interactions. i need someone who understands to read it.,bipolar,2
06095b03-a806-4f92-b0e4-391d6aa16bcd,i’ve been hospitalised and my boyfriend broke up with me,bipolar,2
dd33aefd-05f1-4246-84f2-58eeee78c10c,i feel i'm failing at life (x-post from /r/bipolar),bipolar,2
674d9b07-b7ed-420e-ab2d-ea49a48456a8,can we have a self care thread?,bipolar,2
427fe492-e286-454f-9b78-4f2092adc0c7,"dae struggle with emotional regulation, even when you’re not in an episode?",bipolar,2
11dcea47-97a7-42ea-b60b-f5e56207aa9f,[update] i begin ketamine treatments in a few hours. i'm a little nervous.,bipolar,2
070e30c3-89ec-45b8-9a7b-fdb41e5e9603,exhausted,bipolar,2
fa756266-ea03-4fbf-bfb1-45432f3106d1,so you think you wana be my friend?,bipolar,2
9262d76d-f495-41b9-9919-9548e1e3a44e,me: mixed af watching black summer,bipolar,2
e68bb452-52f0-4967-9fe7-1c5c579ff33b,everything i do is pointless,bipolar,2
3c2109ce-1197-49bb-9b28-e212ad2b9f7c,"everytime i take a ""sick day"" it only make me feel worse.",bipolar,2
9f00a53e-65c7-4afb-9e0a-92fe67ee7352,i got a full time job in a library!,bipolar,2
ca070782-705d-462e-8ebc-5296cf8ce764,"chronically leaving my apartment a huge mess, cannot seem to stay tidy, or keep the motivation to stay tidy. any helpful tips?",bipolar,2
4e2a43da-ba79-4c40-b290-2a93a6c4d315,doctors need to tell us about the possible side effects of the medications that are prescribed to us,bipolar,2
3c87825d-f4a8-415d-8373-4681c2d5c5ca,everyone else is graduating,bipolar,2
69c81c6d-be0f-4c55-903b-d51b8d4aa800,pregnant and bpd2,bipolar,2
983fb26f-143c-49d1-80c0-09f8da7be4b3,adults with bipolar disorder at equal risk for anxiety or depression following mania,bipolar,2
e9fab3b1-6776-4a68-b9db-530577fa625d,struggling with at work? /r/madatwork is a new sub for help with mental health and illness in the workplace,bipolar,2
25e5dfe8-6c7a-42e3-af7d-5ccb0f3f5ca5,"in the wake of all this kavanaugh crap, are any other women here feeling defeated or vulnerable?",bipolar,2
5677f2df-14cd-4ccd-861d-8960a5b780cf,i wish there was a cure.,bipolar,2
f233c1d6-72b8-4c03-bfe8-2d5f84ec5370,unable to hold a job for long,bipolar,2
6d0c7e99-b3fc-4219-affa-cb22840d5526,bipolar and college.,bipolar,2
c8ad15b8-4641-4e6b-aa98-7fbfff6faa15,i was happy last night for the first time in 6 months,bipolar,2
6f745806-95d8-4573-967c-651caad8ec1e,i'm proud of myself! i made a psychiatrist appt &amp; i'm going to ask about lithium?,bipolar,2
2717f351-aee5-47f5-b29c-177edc10fbc0,give me the strength to go to the er,bipolar,2
4dd19503-14f1-4421-b60f-18a19744c6f1,trigger warning suicede/self harm,bipolar,2
204bc5e9-260c-4d55-baba-c63abd2f07c5,i need to live somwhere where it's autumn all year long (and not for the pumpkin spice lattes).,bipolar,2
b7ab2fb4-926e-4248-94b1-e5d9ff62c3ce,my wife is bringing me to the hospital. or why it's not a good idea to stop your meds when you're feeling better....,bipolar,2
bfe29dae-a1f9-469b-893c-54c5d8cae37d,"“just when we think we have all the answers, all the questions change.” - mario benedetti",bipolar,2
41de5693-6df3-4d20-90f7-d4e62dd96510,what does bipolar feel like?,bipolar,2
f26d3f4e-6a49-41d0-8bdf-c0f8e8ca1644,i think he actually wants a divorce for real and i think i have to agree to it and i don’t want a divorce,bipolar,2
ade4d702-dd69-45b0-9740-2c6015afcdd5,i got evicted,bipolar,2
fb96c164-c83a-419f-a67c-a219a0fdbee4,"finally coming out of depression, and i feel so happy (but not in that hypomanic way)",bipolar,2
416d93ce-5041-4899-b3e7-ab7074d1de9d,it's like jerry springer is on in the waiting room,bipolar,2
befd44b7-211e-4df2-92cb-8d5558a7979e,dog was peeing all the time ... i got tased and 4 days in hospital ... she hasn't peed since.,bipolar,2
5b035d3f-e92f-4c35-8471-977634465bc6,"i planned a trip to the zoo for my mom and she said ""act normal, act 28 years old. you get embarassing.""",bipolar,2
b99f5b0a-bf37-4b8a-b966-20a460b9eff9,weird place,bipolar,2
ea6bca72-77de-4c51-a816-cdcc56bd925d,how do you cope with oversleeping?,bipolar,2
8becc702-39d8-4d4b-8fe1-8901468664dd,mental health “experts”: bipolar is completely manageable. just follow these 30 simple “habits” every single day!,bipolar,2
af7fb41c-1d06-4bbf-a568-9d58822b95c9,it’s unhealthy to dismiss lifestyle changes to combat this illness. medicine isn’t a cure-all.,bipolar,2
56615fb4-6bd1-4692-a116-32ef9b74880a,my psychiatrist told me to man up and fight!,bipolar,2
718d8f8a-8265-4e6b-ad9a-426233b0bbaa,is this mania?,bipolar,2
0dc2407e-d8ce-4b38-ac64-5e5a0e15991a,i guess i'm hospitalized again,bipolar,2
2cdf6baf-6f54-47e8-921f-b18802d8ddc0,me: how do i know my meds are working? maybe i should stop taking them.,bipolar,2
ffed7941-c3b1-4f74-8267-065329e6973c,existential depression,depression,3
239814dc-c229-4637-a36b-2f0aaf285a00,"if i'm holding off on suicide for the sake of others, i feel as if they owe it to me to make me not want to commit suicide",depression,3
bc0e4a98-cd7f-4f84-8b48-fe104c89488b,"depression is having no drive, purpose, passion, or commitment",depression,3
c0ca3887-ec8c-4882-b253-496e0d49424e,i wish people would understand,depression,3
22c25dc8-0197-4d7c-b718-a9b85c89a4e7,went for a walk today to get soda,depression,3
91349c3b-9a34-4dcf-bcb8-e909d42c5d97,why is it looked down upon to be okay with being 'mediocre'?,depression,3
5edad0c1-85c6-43be-bb16-8020031c7eef,i hate when people say this after someone commits suicide,depression,3
49fd316f-89db-465a-a758-786f03d1c335,i hate when you feel slightly okay for a brief moment and your mind tells you that you must actually be a fraud and there's nothing wrong with you,depression,3
a93d89f1-94c1-4e97-9ae4-540223aaf494,"no one texts me, calls me, or visits me. i’m alone all day every day and i don’t understand why no one cares.",depression,3
7f0c1ad2-e5d7-4acc-9b0c-7d6da56df7a3,my friend killed himself,depression,3
a857c0a9-6976-46e0-a616-692032ac6810,my last hour that i'll be alive. 3/07/18.,depression,3
e3a2b0b4-b817-4bff-8277-3547bcbf8219,anyone get jealous when you read that someone died?,depression,3
fcb4bc32-1c8f-4bb8-89ca-a549ec6a7df4,"28, no job, no career, no friends, no life, virgin,",depression,3
d60e1919-a2d4-45dc-908d-0a9073a1018d,sometimes i feel like i don't qualify for depression,depression,3
5cc4c1cf-50e7-46b0-a0f5-be3b47bb6034,i just want to be held,depression,3
c9268511-71fd-4df5-a18e-bf0a2b7bbc63,my therapist says i no longer fit the criteria for depression,depression,3
daa4b697-5a73-42eb-8975-fabafca05e42,i've made a new cbt site for depression,depression,3
36c99794-6204-48a4-9355-dc0711adf931,scared of helping people here.,depression,3
06c46a00-7d90-402b-b9c5-3c0aaa470a91,i’m only 19 but i can’t shake this feeling that my life is over.,depression,3
6ec1fe0c-8224-46c5-8495-4a5aa884737b,mom died last night going to be needing all your love and support.,depression,3
74769a22-0d5f-4300-b0a0-1cd316dd4831,ever felt like you're just a fucking burden to everyone else around you?,depression,3
d7be23ea-2cac-4ae7-9614-7d4f616cdfab,oh fuck,depression,3
8007107c-113b-4556-b486-40419266e112,my partner of 7 years passed away,depression,3
b47f551f-b75b-4463-b609-21bf453df174,"as someone who has always suffered from depression, i met a girl who made me feel normal for the first time in my life and now she's gone. things are going to be hard from here on out.",depression,3
9e7f4c8a-7263-45fd-8ca2-ba9bbce200f1,does anyone else want to kill themself but they don’t want to do that to their family so they go by day by day with the only true motivation in their life being the day they finally grow distant enough from their family that they can end it all without the guilt,depression,3
57aaafe7-fdb7-43e9-9849-290f10983386,anyone else have semi-suicidal thoughts on a regular basis?,depression,3
297eef51-a6f3-477c-82ea-71b43a144180,"getting pissed off when people describe suicide as ""selfish""",depression,3
96b7599f-868b-4ce0-b940-523485b5d945,"hi, i'm the smart kid failing school, yes i know i have so much 'potential', no i don't just need to 'try harder'",depression,3
8578692a-a4b3-4f4e-b04d-770d7c281546,today is my birthday,depression,3
21be003f-3fd6-4370-9042-8de4689cfdbc,it's my birthday...,depression,3
cedb25d6-7503-4cc1-8c29-9745e6f2ef06,i can finally read a novel again!,depression,3
cb8c1180-369f-4c8b-a146-f9f5e28d806e,idk why i turned to reddit for an outlet,depression,3
0dadbb19-2d46-4d71-b273-9039b9d7a6cb,a poem i wrote a while back...,depression,3
25da7f88-37ee-457c-bdc3-0c897f1da50a,i don’t think i want kids i don’t want them to suffer,depression,3
3934a9be-b9dd-4c26-899b-c9e871ae5d56,we've lost another.,depression,3
c8e96fb5-7784-457f-a09f-dfb118147261,open letter to my son,depression,3
25d422c0-ac85-4605-868d-3b58d743c716,i just want to be soomeone’s first choice.,depression,3
2954ae33-2165-4b07-9f26-afdcf5069dcf,i decided to go to the movies alone,depression,3
6dec4f01-9346-4601-9e43-030c0ab5e08f,i havent cut in a month!,depression,3
f790fc88-514f-4cdf-a8bc-f5ac99dbb850,high-functioning depression: i feel like i'm living a double life.,depression,3
36bd2e58-cb59-425e-b1bb-8b48df3f6c92,"it's addicting, isn't it?",depression,3
7702e5d6-d7e3-48d4-8634-e92d669a8adb,"dying is easy, young man, living is harder",depression,3
28b13790-9591-4422-bcc3-808052382c0f,i want to be loved by somebody,depression,3
439fa2ca-2232-4d08-a64e-d52d6cfc1463,goodnight,depression,3
adb6e855-6997-4077-af2b-ae341e28a669,are you ever so overcome by sadness that it causes physical pain in your chest?,depression,3
267b7628-8f69-4566-824a-095f32557895,i genuinely struggle to cope with the huge amount of work/effort/energy that being alive requires. how do people cope with this and manage to enjoy life?,depression,3
da7abdf3-a3cc-43e1-bd62-3c2faa53c695,i am not going to end my life.,depression,3
02ce29df-6afe-4543-8483-2496aa861dbe,it's been 3 years since the last time i had a conversation with another person,depression,3
2f9c6d6b-a7ba-45e3-a667-cd883cca4131,"the shittiest feeling is looking back on your day, and knowing full well you could've done a lot, but you didn't.",depression,3
4befedea-8fa2-4cf0-b664-c020d6099389,today is my cake day. please give me attention that i don't receive in real life.,depression,3
9c1c3f76-b853-494f-ba75-bfd8295b5007,some people die at 25 and aren't buried until 75.,depression,3
8b1d584e-d23a-4891-8892-d3e3248a001d,it's my birthday today.,depression,3
0f4ff7a0-9c2e-4bbb-8606-503259f64a41,i'm 18 years old with $10k to my name. i feel stuck and i need to get out. i just had dinner with my family and told them i was gonna go to 7/11. i'm halfway to the airport.,depression,3
91d85179-f446-4afa-bbce-bf6470f384fd,"please upvote this, i'm desperate for validation",depression,3
94d402d8-1049-4965-9ae1-bf27d6979f80,fuck depression,depression,3
b1e7cd3e-a0f4-47dd-b3a6-2d4e7d00fda7,i just called the suicide hotline,depression,3
f5ee34e1-5f8b-4d7d-92b6-65a7ece6e546,"do you ever just stare at the wall for hours, thinking and feeling everything, unable to move?",depression,3
b9a32908-9beb-464d-ad2d-53379d50dd27,why i'm leaving /r/depression,depression,3
cc27f9ec-80b0-4ec5-92a3-e3967e3b1a48,i got raped by a teacher from my college,depression,3
f746e87b-a65c-4d3a-b558-4018e194df9a,advice on getting diagnosed?,depression,3
fc3ec173-3781-4f8e-b689-9c168ce2af2f,"i did it, reddit!",depression,3
bbe54ca3-6219-4b28-ab34-870738ccd564,"tomorrow, i will ""nuke"" all of my internet accounts. today will be the last day i will be online.",depression,3
679b9610-2ce1-46ee-bfff-74ff07f0d94e,i died once and i’ve forgotten how to be alive.,depression,3
08ae34f0-9436-4666-a9b1-e45a06c49108,i got up before 9am today!,depression,3
9af0f067-6b69-4b94-84a7-64f62d053d80,rewatching the fellowship of the ring for the millionth time and one of gandalf's lines always sticks with me. thought i'd share.,depression,3
f02ae6c1-1265-4af5-862f-b976618403be,does anyone else feel like it's inevitable that they'll eventually kill themselves?,depression,3
a11efc50-6613-423d-aab8-821e897948f9,"ever think ""if i only had x i'd feel better..."" ?",depression,3
184f37cb-6933-44ca-8c0e-9a134f51da15,why do people want to romanticize depression?,depression,3
c3974b37-a4b7-4e18-a8c6-e96d4c3af8ce,"today, my friend walked me to the arcade",depression,3
01ec526f-9326-432f-a931-1a3aae430de6,does anyone else feel their life won't go anywhere?,depression,3
b6f7302a-0808-474b-a322-46d81469419c,has anyone else always felt like an outsider?,depression,3
8354e5f4-5df0-4391-8f18-3387bc329ed9,"anybody else ""mentally"" self harm",depression,3
326f1d37-bf8d-4c31-ac1c-5191be9091e8,here's to the depressed without reason,depression,3
167831d8-a173-4dc6-904c-67bb5aa596b7,i think depression is turning me asexual.,depression,3
dc612bb5-a001-4006-827c-9064b4852e3c,i wish i could trade someone's cancer for my life so that they can live and i can die,depression,3
be34ff52-129f-402f-96a0-ff26a1218752,i have something to get off my chest. i have no where else to go.,depression,3
7a21a9d7-2948-43d2-8f38-281ea7e5bf18,"people say that when you are suicidal/depressed, you should talk to someone, so i do and then they make me feel even worse",depression,3
b279ae91-0764-4f1d-af05-3f66c96923ef,"the worst part of depression for me, is no longer enjoying things i used to love",depression,3
125e9b13-aa31-4ed7-ae0c-44f38469e651,does anyone else spend a lot of time just looking back to specific moments in time when things were better for you,depression,3
a1a70c33-7a97-4982-91ab-4d64dc85c073,does anyone else watch the same shows over and over again to find comfort in them?,depression,3
07ca62e6-1f25-4aa0-b313-7f46f134f002,i forgot what it feels like to live without depression...,depression,3
4a48703d-c269-4421-a895-55e910e16468,do rainy days calm anyone else down?,depression,3
4f72ae92-eb8c-4003-8e0a-a896557db6fb,the saying: “you’re going through this now so your future will be easier than everyone else’s!” is straight bullshit,depression,3
86e6e3a3-c5a3-4427-9771-fb208c895fba,"tbh i wish i could tell my younger self that no, it doesn't actually get better so that she can just off herself already and stop suffering (just venting)",depression,3
d5f7b205-57ee-4d4f-ae48-e293d4be56d1,stop using your depression as an excuse...,depression,3
e731ad59-368b-4694-a324-9441ed2f760f,i just had a date...,depression,3
5b209a76-2b19-4e36-8f14-61d8a9025517,fuck summer,depression,3
1216b6ee-84d2-4d8f-88cb-c28dd5cd1cc8,nobody talks about the memory loss,depression,3
6ac2a982-6423-4638-8c96-d8c0313d7289,"in 8 days i have lost my job, my girlfriend left me and i’ve diagnosed with cancer.",depression,3
7d5022e2-484c-4039-a806-e36b60b64bb7,i just cleaned my room for the first time since november and i'm proud of myself.,depression,3
dc76ac81-611d-4e46-8363-14fac0d239dc,i am trying. people don't get that simple existing when you have depression is completely &amp; utterly exhausting.,depression,3
075e2937-bfd2-4081-98d9-2881e2163640,i always hope to be killed in an accident or murdered since i can't go through with killing myself,depression,3
b49f5a61-bae3-4a89-bf00-029fcf586d88,i'm the thing everyone likes but nobody wants.,depression,3
69ee4967-2ee5-47b6-bff1-d9aea1e5eb19,i'm the only person who knows how sad i am.,depression,3
d6552746-707b-42a3-b9e8-ca40982cea67,nobody really knows 'me',depression,3
c8cde313-4ed4-489c-82bf-ddeceb34f43f,the worst part of depression is that it's stolen my personality,depression,3
77a2a294-c135-4ef4-89ae-7d45e3a6350c,does anyone feel like they just don't belong anywhere? i feel like a stranger all the time.,depression,3
4121cb72-fc8f-4b84-a0ae-29abbd61e4fb,"it's true: unless you're about to die or dead, nobody gives a fuck",depression,3
8723e0f7-6365-459c-8a0f-613f9b6ac247,anyone else struggle with nostalgia and not being able to let go of the past?,depression,3
ff70e7ab-92bb-4843-8934-7072c69ef1c4,i'm becoming increasingly bothered at the lack of sympathy towards those with mental illnesses,depression,3
981e6aa5-5514-48fb-abb1-0eb7bcaa472c,i want to love and feel loved back,depression,3
c4e9c795-ef50-4579-a6c6-9e09cd21504c,living a lonely life can suck,depression,3
c7797a40-7118-4678-833d-50e8755bb2f1,"“grow up, become a productive member of society, stop being so entitled. no one likes working/taxes/etc. you just deal with it.” that’s why i want to kill myself, asshole.",depression,3
fec050c0-44ea-4a14-87ea-76648259ac59,"today i brushed my teeth, took, a shower, exercised, vacuumed, played with my cat, stayed hydrated, and read a book.",depression,3
2ef6edbd-0a87-4478-ad9b-a7cdf718ad2c,does anyone else fantasize running away / starting over somewhere completely new?,depression,3
aaaabfe4-53a7-44a7-b828-ec29b1d5e802,anyone feel really dumb? like you've lost brain cells over the years?,depression,3
52ef24ac-d25a-402f-ba5e-0b9df8476a21,"does hearing ""college is the best time of your life"" or ""enjoy being young while it lasts"" freak anyone else out?",depression,3
d7306b4b-7cad-43ad-a8b1-6d916339f1dd,what the fuck is wrong with me,depression,3
d44d465a-bae0-4dd4-bf19-4b9dd6966705,hey! 24-30 year olds. over here!,depression,3
c8a5c5c1-fc19-4377-80e7-ff4e6406a5fc,this louie c.k. quote has really been helping me deal with death anxiety recently.,depression,3
f1dfbf11-b91d-4e2c-8c5f-60675614fa3f,depression made me an idiot.,depression,3
2f3c484a-e20e-44c4-878e-c09aab9dd28a,understanding depression using spoons,depression,3
4c22bcf5-8cdd-49ac-b44f-dc1242fee9e4,i'm 36 and stuck in years of misery. depression is my self identity now and i don't know how to change it. planet earth literally seems pointless and i dont' know how billions of people can just live these meaningless lives.,depression,3
b31cbf40-f873-4145-993b-70434993d2c8,dating someone with major depression is so challenging but i guess also rewarding,depression,3
9809471f-6156-4cb1-a1df-dd48f9290b0a,today would have been robin williams' birthday,depression,3
7e289f2d-1bf3-4410-b9b4-b3b2a05f6b06,"anyone else have underlying sadness even when doing something ""fun""?",depression,3
7e688ddf-3ad8-4f33-83ae-157fed287556,"last year i wanted to changed my life, i stepped out of my comfortzone and now i'm more depressed than ever.",depression,3
c08c92a8-82cb-4205-bf25-58454e8487d5,job interview,depression,3
8966ed4f-5256-43ed-8879-dc4aec06a6f1,i’ll wind up doing nothing with my life.,depression,3
d09d99ab-54de-4b9f-9713-89f0aec2d07b,i got my degree!!!,depression,3
72e7a4e5-832c-45de-bb4c-24970a1f4f25,"i know nobody's gonna see this, but i'll post it anyways. for myself.",depression,3
98babeb6-980c-4c29-a581-7028f7c9f638,"for me, the worst of depression isn't in the lows, it's in the grey",depression,3
ae7569f8-5038-4277-8b30-4b45dd0534a6,"my automatic psychological response to any kind of stressful situation is “just kill yourself”, and i hate it.",depression,3
65f8b9e7-63c5-4558-ab6c-e60d1819bea6,does anyone else have a constant feeling of not fitting in or belonging anywhere?,depression,3
e03d46eb-001e-4c79-b500-730847d2fe1b,i'm committing suicide by hanging.,depression,3
bb93fd36-d729-4bde-95e6-0c715af0fa2d,bought a gun,depression,3
2cebf1cd-ed4b-4918-b8af-0756895c9d2d,i saw disney's inside out. it hurt.,depression,3
eed6aa6d-8c7d-46f2-8171-4147a0d71ca7,"hi 👋🏻 hello, new group. thank you for being here for me; when i typed in “depression” i felt relieved because i now have somewhere to go, i think",depression,3
07e1ec23-5a8c-4d85-b611-9101bed253b6,anyone else afraid of eye contact?,depression,3
56200463-8fcb-4856-aea4-10189db56f0c,"""the worst she can say is no.""",depression,3
137fb808-c11b-4360-89a7-0651cf8fd02b,the only reason i'm alive is because i don't want to ruin my family's lives,depression,3
951bff33-5b43-485d-a49b-d7d678164271,"life is like a movie and i’m an observer, watching it, while everyone else is actively involved and enjoying their role in the movie.",depression,3
0be0b6d8-6b62-4833-ad90-f58bec1febbd,does anyone else feel like they’re falling behind everyone else their age?,depression,3
b6d0faa7-2d9c-4472-a9df-46ad38f2274f,went to the gym twice this week.,depression,3
420ec140-633f-470b-b951-506d6bdbce78,i took a shower and i’m proud of myself for it,depression,3
1f3cecb4-9536-4d82-9dd7-9de97aa3d47f,"i just wrote a poem about isolation. maybe no one will read it, and that's okay.",depression,3
80a08622-310a-4f53-bc1c-3586848a852a,my father asked me if there was anything i wished for : (,depression,3
ad37980b-0c05-4818-80ae-68fcf8fb64b2,i'm so fucking alone.,depression,3
dedfe97e-2a14-445a-a4ac-623917976c17,if one more person tells me that i won't know stress until i'm 30 i'll kill them instead of myself,depression,3
401872ce-8c81-4749-b643-beede03b1841,"i wish i could just tell people i'm not ok without making them feel obligated to do much about it... feeling understood and accepted is so important, even when people can't 'fix' you",depression,3
67f29cf1-c84e-409a-b7fb-42ddeb4e43f0,"dae get the feeling that out of everyone you know, no one has an interest with you?",depression,3
54e7dc6d-d9ec-4b3f-b7a8-eb83babeae3e,everything that makes me happy is temporary. everything that makes me unhappy is permanent,depression,3
d67e9d41-ad88-478b-b897-3fc8d353c531,told girlfriend i'm suicidal and got kicked out,depression,3
5f2e5d19-d75b-4f7f-86e1-9ed2612d319a,gf (28) is pregnant - i (26) hate it,depression,3
f71e13a8-b03b-499e-80df-ab9fedb9f3dd,i spent my 25th birthday alone and hugging a pillow,depression,3
bd977b0b-3461-4c7c-89d5-fa9633b78464,i cleaned my entire house!!,depression,3
f56dbb6a-52d6-4543-8455-3f67c985a289,"the worst thing isn't being alone, it's being surrounded by people and them making you feel alone.",depression,3
48af35d3-85d4-4a9e-b8fd-5e4279f6422e,do you get ignored a lot?,depression,3
f01658d7-8719-40c7-8c90-92e4ae587cea,making up relationships in your head. it's a sad world,depression,3
69fe88e8-3e42-4e4d-9108-9ed88a8a7e6c,anyone else have long conversations in their head that they can't muster the courage to have in real life?,depression,3
81e9cc55-9efb-4edc-bbca-0d91ac0803c1,anyone else scared that there is nothing medically wrong with you and that this is just how you are?,depression,3
0ed98d34-aa9d-4fd4-84bb-9a25182b5771,we're learning about depression in health class right now...,depression,3
ed13e96f-3b09-4495-a86b-fc690d3c8746,"on april 11th my girlfriend and i attempted suicide. she died, i didn't.",depression,3
583dfc59-dbf0-4361-acb3-34b77e9f9999,anyone else just feel bored of everything?,depression,3
b6aa75ca-0651-4199-ad13-62f64bdff575,i actually went out dancing with my wife,depression,3
b44223a7-3ad7-400a-a52d-c3d863282c30,my mom died yesterday.,depression,3
e57cabed-8f6c-45a9-b0e3-b2e1f2f285d3,has anyone else felt like they lost years due to this shit?,depression,3
85aaf920-8868-4be6-8138-dc74cceddf4c,girl i talked with on the suicide hotline plays fallout. that kinda cheered me up.,depression,3
3a373975-f1a2-4d4b-b6ef-1b2fa9a1a415,she won't date me because i'm dying,depression,3
e62b961c-9bb1-4560-9efb-709bb36cfc65,sometimes i think we are the normal ones.,depression,3
ea6def73-2885-49ee-9498-840846f03b7d,"i gave my girlfriend time to rest, and found out she was more than just tired.",depression,3
32b3c286-5ca0-42c1-941e-b13203faffa8,life really isnt worth living.,depression,3
f066d506-1f64-4c38-b34e-069fd93ea4ac,"i don't want to exist, it hurts so badly, and i can't stop crying.",depression,3
8aae64aa-7d47-4c4a-819a-129432ad05ec,filing for unemployment is just a big reminder of how fundamentally awful being alive actually is,depression,3
507a46f6-70e3-42b1-b3ea-af4dd53fb4b9,man’s best friend,depression,3
20e65211-9871-49f5-9bcc-53be27bc4dce,i'm deleting all social media including reddit,depression,3
f879e0f5-2059-4b10-bbc7-1045db4fbb1a,"i'm sorry, mom.",depression,3
d5399d51-db98-4c3d-b672-34a873daead2,it's been about three years since me and my ex fiancee broke up. i still think of her and her kids all the time. i found out yesterday that she died.,depression,3
2d394811-5b7b-4018-a9f3-b686deb41ad0,"who else got hit with that ""depression/anxiety"" combo?",depression,3
7471d68f-0e56-4b66-afac-47c205d3cfe6,"does anyone else here have moments where they are laughing with a friend, and then you realize you're laughing and suddenly your smile instantly fades and you get all depressed again?",depression,3
44de12a0-7821-4da2-8eea-90ac1eda16e6,"the reality of depression: yesterday i was googling ""most effective suicide methods"". today i feel fine.",depression,3
c7dc8526-dc58-44c3-badb-3f2b02f79284,i wish i could give my life to someone who deserves it more.,depression,3
b5fd73b4-8c8e-4872-b691-ec7607a03a0e,it sucks when you wake up and the best part of your day is now over.,depression,3
dbe1f223-90d0-4e10-8452-3aed04930338,anyone else feels like he or she is too tired to be alive,depression,3
3de87075-e5d4-4ea4-99d0-575525121c03,"do you ever just, want to be evil?",depression,3
05c44f8e-8595-42a9-953c-fc021be48015,does anyone get triggered by being yelled at?,depression,3
b659d94b-e581-4dfd-8cce-78e588ac6fc5,i can't stand being alone anymore,depression,3
