ID,title,class_name,class_id
e764dab2-d6ce-42fe-9e8b-4e27067e5a95,i often find i am losing myself to physics/mathematics and it scares me,none,5
16a02e89-674f-45cf-831a-a703ea6304a6,"science ama series: i'm dr. yogi goswami, a solar energy scientist and inventor, currently developing the world’s first molecular air purifier, ama!",none,5
36d0dddb-fcf0-46b8-9be1-07290c93dee0,what are some good milestones and resources for exploring fractal mathematics?,none,5
7c7127cc-8502-4772-98d1-5fdd636d6909,"i'm currently sitting in the campsite in vík, iceland damp, tired, and freezing my ass off...",none,5
2a23ad97-e744-453d-be65-5170c90adeac,i don't know how to find a weight matrix for modelization,none,5
145978dc-d9cd-412b-99df-e5df7fa5ea94,"after doctor files lawsuit against dea, he is persecuted with criminal indictment and unjust detainment. help us get his story out to the public.",none,5
6fc85312-1cd3-41f2-bbc4-336b4f121ac1,helping with homework will earn you a seven day ban.,none,5
c204559d-974b-4d1f-b54a-1a8e4b0430cf,reverse engineering a bézier curve,none,5
fd428ac9-4418-4de9-9dee-24333bf76d20,why isn't election day - arguably the single most important day in a democratic society - a national holiday?,none,5
28b37f96-9905-44ba-92ce-45d60abce6e8,i think taylor swift stole this dude's song...,none,5
beb31510-720a-4ac0-8096-4052c45c8aff,"i’m rick astley, and you can ask me anything, again!",none,5
53e8fc94-7776-4932-b56f-b2f1ffd9a119,what do you guys do with the datasets?,none,5
ddfd458f-ed7a-4033-9c49-64f431ee7fda,grammar error check,none,5
04bafb4d-ffe6-4563-ae45-93ef990a387e,"science ama series: i’m aleix martinez, a professor of cognitive science and machine learning at the ohio state university. my main areas of expertise are face perception, emotion, and language. i’m available today to answer your questions. ama!",none,5
573cc9ca-1f5c-4e70-9338-c0ec0f2cfdd9,"thoughts and pictures on my recent trip to sudan, highly recommended destination!",none,5
1b9ec653-c664-4d29-a12f-523fe098c961,"these 61 senators are refusing to meet with their constituents before the critical jan 24 vote on pipa/sopa. oh reddit, can you call them?",none,5
e8b66bb8-8ee7-485a-ae19-872201cd2291,"hi, i'm mel_gibsons_ass and i worked at one of the top 20 party hostels in europe. ama.",none,5
32033189-0fc9-42ca-bbfa-f87340c104a7,"science ama series: i’m paul wyman, senior scientist at dsm, i develop materials for solar panels, ama!",none,5
ec85a7b1-a871-407b-bfd0-e986d53ed518,"til in 2004, around 200 women barged in a nagpur district court with chilli powder and knives; his penis chopped off and akku yadav was lynched to death in front of the judge. he had 88 cases against him which included rape, murder, attempt to murder, gangrapes, extortion, etc. in the last 14 years.",none,5
c05852f0-f7d9-4776-9f91-563ae017c189,airbnb in berlin cancelled due to legislation,none,5
413ce4fe-2ecd-4378-8367-17b3d0315cad,"plos science wednesday: hi reddit, my name is anirban banerjee and i discovered tiny sacks of toxins may increase the risk of premature delivery in pregnant mice, with implications for preterm birth in humans -- ask me anything!",none,5
6b89005d-0b5f-424e-8ea9-bafc78e06be9,"indian hacker group ""i-crew"" hacked and encrypted 200+ pakistani government and business websites in a ransomware attack. all their files are locked and can be only unlocked if they donate to crpf fund!",none,5
02a20616-0d20-4458-b286-5b2dc595b24b,"it seems to me that many national policies supported by the republican party are contrary to what they would call the free market. government insurance used to protect derivatives traders in the event of a crash, for example. in a free market, failed institutions would be allowed to...fail.",none,5
ea252ab8-89a1-44de-ad26-cc33c8ae136d,oxford student harassed by indians on quora for being able to solve the jee advance question paper,none,5
1056de25-43b7-41de-b40d-09e54db06b32,resource for maths exercises,none,5
9fac6da9-8d09-4d00-8505-f344b471ce9f,"i'm roger lemon, a just-retired professor of neurophysiology at the institute of neurology, ucl. i do research on understanding the cerebral control of hand and finger movements in humans and in non-human primate models and i’m here today to talk about it. ama!",none,5
045e4e0a-393c-4eb1-928f-7422a2940aa0,"science ama series: hi reddit! i’m olivier george from the scripps research institute, here to answer your questions about how drugs and alcohol affect our neural networks! ask me anything!",none,5
defa71a8-4004-47ba-974f-b55683e6a6bd,crowdsourced guide to travel planning,none,5
b0f26a46-82d3-45c7-90c2-6b87de5d550a,svd in ill posed problems,none,5
93dc1053-16c1-4ad2-b84c-da5a78a6b22b,"do you speak khmer, burmese, vietnamese, thai, malay, mandarin, tamil, filipino, indonesian, lao or malaysian? if so, please considering helping out a fellow traveller with a severe allergy. very quick.",none,5
f3bb932e-7771-43d9-be0b-f083c6eeecda,"acs ama: hi reddit! i am sally mitchell, a science/chemistry teacher and recently an albert einstein distinguished educator fellow posted at the department of energy’s office of science in washington, dc. ask me anything about the importance of good english education with stem teaching.",none,5
efedd05d-6126-4eac-8ea7-0641f72992f1,india media - credit where it's due.,none,5
98cf8840-faf1-4d98-a067-d74261bed524,here's how much it cost to travel for 18 months,none,5
65aace73-2bd8-4fd6-a33b-0cb5bde808f5,"science ama series: hi reddit! i’m dr. mark pimentel, gastroenterologist and scientist studying gi-motility at cedars-sinai medical center. i’ll be talking about the role of small bowel bacteria and ibs, and microbiome linked diseases. ama!",none,5
a30d5b26-e60f-409b-b70a-c556dd6444d8,i hate all of the tourists here now,none,5
1c53a9b5-6a7d-4762-98bb-a77be4c5327c,"science ama series: i'm joanna bryson, a professor in artificial (and natural) intelligence. i am being consulted by several governments on ai ethics, particularly on the obligations of ai developers towards ai and society. i'd love to talk – ama!",none,5
d9c97c16-7d85-4099-a1f3-887e0a3ccd0f,is the grammar in my letter for canadian visa application correct?,none,5
f7ae0e9b-2325-4081-b56e-8e845357219b,for anyone interested in budgets here is one year in south and central america broken down.,none,5
291cb53a-729c-4f0e-bb84-7326a3b6cc52,109 manga books with bounding boxes around character faces and around japanese text,none,5
44315969-10de-4566-9e49-1d1482b073e3,any material recommendations for someone aspiring to become a mathematician?,none,5
92062dc5-a517-497e-8e6c-0b105dff1a9e,real analysis,none,5
6672588b-6fe4-48f4-8029-773cfea953fe,"science ama series: i’m dr. jessica ribeiro, a professor at florida state university, and i’m here with nbc news mach. i'll be answering questions about my research in using ai to predict suicide for about an hour beginning at 12:00 p.m. et.",none,5
6b8850d6-93af-43a1-b5b9-c604a51f4638,the chain by fleetwood mac,none,5
cd742608-1be4-4404-be15-0b756bb89129,new paul mccartney album 'egypt station' coming 7 september,none,5
71b8b4dc-2a24-4fe0-953f-665548ceddf7,science ama series: hi reddit! we’re dr rhys hester and dr todd hartman. we published a paper on racial bias in criminal sentencing which highlights inequalities in incarceration rates and sentence lengths for minority offenders. ask us anything!,none,5
89296fde-65b8-4cde-b97c-e21bd82af66b,heading to ho chi minh city? i've got a food trail for you to follow,none,5
0ec0510c-3495-41a6-9089-f52c0e2a77d3,what is wrong with these?,none,5
8bc15595-13da-44b8-a64a-58fc1053df01,anyone else feel lonely after traveling/living abroad?,none,5
720aa973-e4da-47bf-bf13-f5139690dbd2,the uses of the present perfect,none,5
4933de53-84b2-47a5-aa69-905cedd52afc,i survived 3 months of south east asia with an anaphylactic allergy to peanuts and shrimp thanks to r/travel!,none,5
ff7f114e-1dcb-4df8-859c-7e8769d9a0ba,monetizing your trips,none,5
da7e2da7-53e7-4406-b726-30c256d606ca,"i am lisa loeb! i'm a singer-songwriter, and i love cats and food. ask me anything!",none,5
d97e00df-e6a9-4870-a050-3f9b3a9d27e2,exciting primitive roots of numbers,none,5
a16f16c6-e79c-4dd3-bc95-b7bdde2d8f58,"goodbye chris cornell, from a fan",none,5
a5f2610c-0b2f-4250-870b-ffaae788a702,looking for a large nhl salary/stat's dataset,none,5
a6be656a-1839-4181-8a30-431c1d75f18c,requesting help from redditors for the entire student community of iit indore,none,5
8a178617-b9b5-4e1c-9369-98cbf404e03d,i'm jon fratelli of the fratellis and you can ask me (almost) anything! -ama,none,5
0857f68a-39ed-4c73-b38c-a129860bc72e,mathematics: an expression for the summation of the derivatives &amp; understanding its properties,none,5
fc3f7aa0-ae5b-4756-86e5-7039886a0372,"the benghazi (now ""emailgate"") investigation has gone on longer than the investigations of: pearl harbor, 9/11, the kennedy assassination, watergate or iran/contra.",none,5
56e60122-683f-4ed3-ab0f-311ec67c1981,jim croce,none,5
653406a2-0c7e-46ca-ab97-69129ae1ad56,skill at/of/in,none,5
5d2f30a8-5531-4562-85bd-60b9e0182226,i`m old but i really miss back when you spent a few weeks to buy a cd and memorized it because it was all you had,none,5
1ce8c1ab-e52f-498b-8a4a-66cc3960f509,"i’m k.k. downing, founding guitarist of judas priest and now author of the memoir heavy duty: days and nights in judas priest. ask me anything!",none,5
208abe2c-8dda-4ed4-9b4e-ca4d2eae5b6f,fuck people who behave like this,none,5
8ee7af63-c8f5-4d13-9f4f-f764572e5325,fbi releases documents in hillary clinton e-mail investigation megathread,none,5
aca44fa0-2309-4356-8f31-8b08e02bf522,"pat robertson: ""iceland punished the people who created their financial crisis, and i think we could teach our children moral values by doing the same to american bankers. they lied to everyone; their lies should be punished.""",none,5
9d98b3ba-6f3e-4320-98d4-6f07721abd9a,"chester bennington passed away 2 years ago today. i'd like to take this opportunity to share some lesser known non-album tracks so that those who miss him or linkin park can have ""new"" music to listen to.",none,5
7dfb1215-ce9d-49b8-ac56-48632e943e4d,"science ama series: hi reddit, we’re benoit lavraud, bill peterson, and andrew yau. we’re all part of agu’s geophysical research letters and investigate sun-earth magnetic fields. ask us anything!",none,5
0d1c886b-1904-4430-a91c-a7985769dbc4,"science ama series: i’m dr. kate greenberg of the university of rochester medical center, and i treat transgender youth and young adults who are looking for medical transition. ask me anything!",none,5
91cbdde8-4a9c-46db-94a6-e6614441125d,"data of unemployment rate, gdp and inflation rate - atlantic city",none,5
55c93827-51d0-4ba0-8d31-ae85bef2c75a,in search of a dataset of suicide notes.,none,5
125cafae-5828-414d-a6b8-2339e5eedb6b,"science ama series: hi reddit, i’m jeremy spoon, an associate professor of anthropology at portland state university. i utilize collaborative methodologies to understand how rural mountain communities recover from natural disasters using the catastrophic 2015 nepal earthquakes as an example. ama!",none,5
fce15100-0f60-49b0-b883-8e84c9443765,"help!!! passport was accidentally donated this morning, my flight leaves tuesday!",none,5
ac3a98d3-1dad-425a-86af-c241c14b4b0b,"5 years ago from today, psy's gangnam style was released and took over the world.",none,5
7d85acc2-1fed-4400-8657-d6fa4d04849a,good reference for projective geometry,none,5
feedb8de-7e80-4e87-b930-7eb6b713062c,watching a series with or without subtitles?,none,5
80299513-bab3-4611-90ad-d9a43e57a1b1,is there a good resource that would help to estimate and compare travel expenses by city?,none,5
8f1582d2-c710-4b6a-93e7-0efddecc52b6,few pictures from my trip to iran,none,5
58cadda9-cb4a-4865-a2d2-1ee060cbbd1b,speak english with natives for free on discord,none,5
3f5e62c6-b585-4c69-bbb7-735e6945a09f,washed up,none,5
9b1e091f-23c3-4e7d-bce6-880759eacdf7,solving difficult problems once and then forgetting how you did it,none,5
044d11af-f140-4f06-83b4-b21ba99552c4,"science ama series: i’m kevin coffey, an assistant professor in the department of psychiatry at the university of rochester medical center in rochester, new york. i have 27 years of experience helping adults, teens and children dealing with anxiety and depression. ama!",none,5
cabcac6a-d1a0-4ce4-a6c4-9432d9b29c72,"plos science wednesday: hi reddit, we’re john and yasser, and we found an unexpected mechanism of cell division in chlamydia trachomatis unique to this human bacterial pathogen, creating implications for developing chlamydia-specific therapies – ask us anything!",none,5
9da3ce9d-8eb3-415a-80d9-3ea91e2f99b8,solving skyrim alchemy,none,5
22c2c64c-5890-4ad4-8506-2f37c0538a0e,moral policing: why people in india can't stand the sight of someone having a good time with opposite gender?,none,5
aae36705-3acb-4c8b-89b8-7e65fd7f5fcf,[megathread] mcmaster has resigned as national security advisor and will be replaced by john bolton,none,5
3e063b46-5c1d-4dd9-a448-1f40c359cacd,fanfic. just... all of it.,none,5
65668578-04a7-492f-b88c-62ff98995d5b,"rep. debbie wasserman schultz just got a primary challenger. meet tim canova. he gets that the economy is rigged, supports wall st. reform, legalizing marijuana and ending the war on drugs. debbie opposes mj legalization while taking money from the alcohol lobby. south florida needs a new leader!",none,5
c6c79582-d628-4561-8b43-ecdba8739c30,an open letter to all indians from kerala,none,5
81543e10-df92-4878-902d-2c3e52d439e9,i need the formula for a 1 1/4 inch offset for a parabolic equation. how would i go about it? its for a cnc machine.,none,5
1aa974d7-8d70-43a3-8fa9-806e91b8c4c8,english for free with natives on discord,none,5
4c01da93-b3cf-4dcf-af54-afb83c3d85f0,"american geophysical union ama: hi reddit, i’m jill trepanier, assistant professor of geography at louisiana state university (lsu), here to talk about the science and risk of hurricanes. ask me anything!",none,5
ec5b8846-6e13-4e74-a7f8-888520f1e777,"in english, is refferring to someone as ""that girl"" or ""that guy"" rude?",none,5
a49284ca-89ba-45bd-a380-0ac9ee1be8f9,"science ama series: we’re experts with the national society of genetic counselors, and are here to answer your questions about the sometimes complicated world of personal genetics.",none,5
37a60cba-866c-4900-9fdf-c1accbbfc717,"black people, poc or people of colour?",none,5
062ae092-994b-447f-a4a2-ca1de46e7aba,a friend spewed anti-muslim hate speech on facebook and was put behind bars for 3 days. the family is now demonising his college friend who had launched the fir.,none,5
a8742b90-8f06-40cf-8979-625c10abcf7f,"difference between ""were"" and ""would""",none,5
ee54bfd5-a166-455b-b65c-392e9d44d42b,"plos science wednesday: hi reddit, my name is israel and through phylogenetics, i identified a new species and genus of palaeomerycids from spain, xenokeryx amidalae – ask me anything!",none,5
a3a4a509-49c4-43fb-969e-d710b1cea34a,"megathread: former f.b.i. deputy director, andrew mccabe, has been fired",none,5
28a7750b-7507-47a0-a228-846162aa5e58,a great place to practice english,none,5
9492d65d-d2f5-4ab5-b8d7-a20270e02975,are there any other free sources of latest news which i can crawl or get using apis?,none,5
2c8b5246-ff2c-4afc-ba5a-8104c95f5a21,mastodon is surprise-releasing a new ep on september 22nd. here is one of the songs for it:,none,5
9b44787f-1aca-4b9c-be71-016315a368fb,what is the lowest sample size for a statistical study to be considered valid?,none,5
6695e346-63ae-4a3d-9cb0-7f791fd42a1b,rant: buying concert tickets online is an absolute joke!,none,5
07878ba5-28fb-4578-8c60-ac9d30cced55,my name's oliver tree and i built the world's biggest scooter. ama.,none,5
a8df5ad8-242f-4ecb-a83b-81fbdef62cb9,i know it is not the right page to share these things but i need your helps.,none,5
34463b86-2866-46fc-826a-3d04c98890df,can anyone back me up on this?,none,5
8ef78596-7da4-4f75-bf6d-c41e2fbec581,why are us tsas such major assholes ?,none,5
6936d461-e86c-49fc-bf6b-2a0c54800270,does steve miller know how to whistle?,none,5
753a8b9c-4d81-4e25-840b-a4fa2f5fdc8e,amazon prime rollout by zip code and date,none,5
6724ccc1-55ea-4869-8ba4-c4d29dc09989,daren sammy has my full support. most indians have always been racist.,none,5
f173b5ab-1c95-4a6e-b957-b22e639b5fee,the things they don't tell you about solo travel,none,5
4df5cafe-ac4f-4351-ac7f-3c378e42e7d5,"what does ""i don't want to be the richest man in the cemetery"" mean?",none,5
65206a88-9dc7-4b32-9bb5-ee0238d67deb,"i am an independent musician. i publicly published all my earnings reports from all the music distribution platforms so people can decide for themselves what services are fair, and which ones are not.",none,5
83a9fe3a-d785-493c-9b47-8ebc611f2c2d,[.xlsx file] 3517 russian-run facebook ads released by the united states house of representative’s permanent select committee on intelligence,none,5
9f7ff0d6-b58d-486c-a08c-35cb5f56e583,"french hacker finds security issue in aarogya setu, says rahul gandhi was right",none,5
2743edbe-112d-4f62-8eda-bb833cc0dcb0,ask your peru &amp; south america questions here!,none,5
dc577701-c1a2-47ee-b266-97c5270bea80,megathread: judge orders justice department to give house judiciary committee grand jury testimony from special counsel mueller's investigation,none,5
557d17f7-77a9-4793-bbf9-0cf8ecf89e90,"science ama series: i’m allard dembe, a professor of health services management and policy in ohio state university’s college of public health. i research the health implications of long work hours. ama!",none,5
0100358c-c716-46f8-8bca-6a331f9a2720,"science ama series: hi this is robert morhard, corrine nief, carlos barrero castedo and jenna mueller at duke university, we're working on developing an ethanol-based treatment for tumor treatment in resource-limited settings. aua!",none,5
e7820c25-01a6-4930-8a55-930e632f0def,is this sentence grammatical?,none,5
c4898c32-afd6-4c97-9aeb-f0fda0d24300,"data on happiness levels at the postcode level (uk, europe, or us)",none,5
3971879f-3ab7-47c4-b98a-ba504113dc21,post-trip notes: wow air,none,5
e0a36a9e-ba6a-4ebe-8f2c-1480ce74ca3f,hathway is blocking reddit for some reason.,none,5
62953a66-e117-4f86-976c-aeadc8f5e1af,i can see them from/throuhg the window. from or through?,none,5
5099d6d4-0301-47b8-99d1-283b91f0b515,english accents preferences,none,5
a702d3c2-6689-4042-9ffe-d38fbc09fda3,friend in need,none,5
be295ed7-76ad-4e68-b0eb-d2db183ddc5b,"how to pronounce ""with the""?",none,5
259cde94-e2db-49da-97e6-2448be18da03,"x-prize ama: i am burt rutan, designer of the world’s first private spaceship (spaceshipone), and the first aircraft to fly around the world without stopping or refueling (voyager). ama!",none,5
f3396aa7-7e06-4a45-afc8-a2cdc61422b3,what is your favorite travel video?,none,5
ef1da7fa-2c2b-4432-a879-c21d3be22267,can we just take a moment to unironically appreciate “walkin’ on the sun” by smash mouth?,none,5
8fcf0228-8f64-44ce-9545-75d82e787abc,i want to understand math.,none,5
5047f581-2361-4d5d-a795-97ee88517d2c,biffy clyro are the biggest band you’ve never heard of,none,5
e95e5963-a207-4d02-8cde-171473ac3d1a,"a series of unfortunate events. after yet another death in an ""accident"" of a person fighting amit shah, i have compiled a list of other such deaths.",none,5
4dec33b9-aff3-4cc0-8e90-9105da842ef0,"we are richmond pop/rock band broadside, ask us anything",none,5
d79eabe8-d94a-43eb-b000-2af2c90f62a3,how do i refer to my cat?,none,5
1d204642-153b-4f42-b3f5-ec2a5e3fcd46,cross products vs. dot products,none,5
8df6efc7-bbaf-4357-a7d9-8bdc788740d4,"while we’re talking about ticket scams, taylor swift and ticketmaster are charging twice as much for handicap seats that are farther from the stage.",none,5
d7517c7c-8ad0-43e1-848a-20d3847d6f7b,megathread: president trump delivers remarks on charlottesville during press conference,none,5
1142af91-63dc-4992-b108-7d68296c93aa,some thoughts on budgeting for noobs. add yours.,none,5
e1a2b647-9d6d-419c-850a-6b5505defb73,til lalu prasad yadav was the only cm who got advani arrested after his rath yatra. he stood strong against the communal agenda of advani and rss.,none,5
cd22357d-9b2e-4439-8924-0f88791c3101,"i know it's been done before, but are you named jenny chen, american and want to go to south africa for free in 3 weeks?",none,5
dcc3da59-7720-4e65-8304-1736a6e8f171,"science ama series: hi reddit! we're ralph keeling, dana royer and nicola jones, and we're talking about how the world passed a carbon threshold and why it matters - ask us anything!",none,5
1518ccdc-89f9-43cc-86be-1860bc72acd2,"i have a function that i made where if i put it into itself multiple times, no matter the starting value, it will give me the same output.",none,5
5e365ac2-a363-4ff7-84fd-ef49c3893e24,less than 50% of the playlists with drake on the cover actually have drake’s music in the playlist.,none,5
0f752351-ac15-4b6d-a5d7-a78285518e08,"english numbers - "","" and "".""",none,5
d18b7348-e5fa-4195-be28-fc62309e9a97,"science ama series: i am justin billing, a scientist at pacific northwest national laboratory (pnnl) where i research the production of biofuels. our recent work – the conversion of human waste to biofuels – has recently garnered a lot of attention – and i’m here to talk about it. ama!",none,5
c9a4b4a6-a159-4264-a630-b4862211a148,is there a discord or a place where i can join a conversational english group?,none,5
bb5be461-775f-4030-b009-9563e9381cd3,traveling the us to karaoke in all 50 states - looking for weird karaoke bars,none,5
82de0e10-3bf6-455b-a5b1-4529cf537f83,"don't use ""whom""?",none,5
37bad18c-59f0-4ba6-8dc2-687c5d9f520a,"travel guide: baku, azerbaijan",none,5
cdc6813c-b69e-44a7-ab4f-e8e4b5e22627,friendly reminder that questioning the official narrative is the real patriotism,none,5
f1ef8be5-ff38-449b-b9dd-0f7e4163db16,what is this solid called?,none,5
e0b4b82f-a30c-467e-b6e3-4df40fdcd48e,"i'm maxwell bero, progressive democrat from maryland's 6th district challenging the wealthiest self-funded congressman in us history. ama",none,5
21b69e8b-e393-4160-b2c4-718cc7fcac41,"plos science wednesday: hi reddit, my name is joel and i published a plos pathogens study investigating whether viral genetic sequences of hiv-1 are similar between sexual and social networks in new york city – ask me anything!",none,5
0ca83315-df91-4c7d-93ea-4d9f427a8e59,looking for us population income data,none,5
f7b12500-e144-455a-a800-c9c89f63413b,"name a city, state or region &amp; name one dish you have to try when you're there.",none,5
e4e42985-a482-4963-87b2-d9c3053fd144,where can i publish 18+ related dataset?,none,5
4b6eff5e-3ae0-4220-978f-22570297cecf,travel has the power to enlighten but it can also turn us into self-important know-it-alls. who are your least favorite type of travel snobs?,none,5
b1ad3e3e-7941-47be-9903-2baa3a6b32e0,fellow americans understand this: we're in a class war( corporations versus citizens ) and next month both non-participation or a vote for the g.o.p. is a vote for the american corporate agenda and against the american citizen's agenda.,none,5
d14603d4-ac9e-41ab-b24b-8e328f7f40c3,problem with learning english,none,5
5cc61365-3962-4b46-ac6b-328716aeeca3,hilbert's curve,none,5
22f09f04-b05d-4950-8bed-f1338753c2a3,"if a radio station can’t allocate the time to play the entirety of purple rain, just don’t play the song at all.",none,5
751052a9-2ed6-4bb0-8550-ea14ffab854b,does anyone else feel really intimidated by how much music is out there?,none,5
440e3e91-e015-4c46-b257-02a47cf32d06,world bank development indicators,none,5
a12318f2-1481-4448-acd6-487bd0c31a18,do native speakers struggle to understand songs?,none,5
785e5a2f-4a3f-4557-bfb2-78998311a3e3,extra united club pass expires 12/31/15 - anyone have a long layover and want it?,none,5
e3d472ea-3b6d-4842-9627-41dc834be11e,"avenged sevenfold quietly dropped a new song earlier this week called ""dose"".",none,5
30b37d2e-d5f4-436b-8c34-aa96d5f11854,i’m here to answer any and all questions.,none,5
76bd2797-7e4b-4a0a-a7ad-b910d36bae8b,question for data custodians,none,5
d8459293-9aef-4c5b-84b1-df18f429f603,"science ama series: we are researchers at johns hopkins university's institute for computational medicine, feilim mac gabhann and sridevi (sri) sarma. we use computational methods to improve therapies for many different human diseases. aua!",none,5
dace534a-e43e-4a96-98a0-b7f8f967e836,"science ama series: hi reddit, i’m mike ellis, head of climate and landscape change science at the british geological survey and a member of the anthropocene working group, here to talk about the impact of human activity on the earth. ask me anything!",none,5
2888e36c-0871-44f6-a925-98693eb88732,"what's the most dangerous situation you've been in, while traveling?",none,5
8918fc1e-ff81-4451-914a-d7393c630f45,third year engineering student switching to mathematics,none,5
5297b73f-a951-491a-8709-f206171f91c5,discord english server,none,5
83ce5811-996d-4081-8e49-5e7ed6090640,"99 senators haven't come out against cispa, and they're rushing a vote for as soon as they come back from memorial day recess. today is the last day before they leave. they need to know we're not okay with this.",none,5
094d5fd3-3ffe-4735-b748-f6156453ab0b,does anyone know of any before/after photo editing datasets,none,5
6caf6411-ba4d-46f0-8581-0bedb95da82f,english speakers mess up all the time.,none,5
715189bb-695b-458c-948e-311fee9d88a2,how can i practice my english skills?,none,5
